,평점,본문
2177,5,백탁현상이 있긴하지만 심하지않고 향도 그렇고 좋아요 아이들용이긴한데 어른이 써도 괜찮은것같아요백탁현상이 있긴하지만 심하지않고 향도 그렇고 좋아요 아이들용이긴한데 어른이 써도 괜찮은것같아요
2178,4,좀 백탁은 있지만 성분 좋아서 잘쓰겠습니다좀 백탁은 있지만 성분 좋아서 잘쓰겠습니다
2179,5,아이들 항상 쓰던제품이라 싸게 구매합니다아이들 항상 쓰던제품이라 싸게 구매합니다
2180,5,GtpjadmwtadmgMagajnpjamtjag
2181,5,믿고사용하는 제품이네요약간의 백탁은 어쩔수없네요믿고사용하는 제품이네요약간의 백탁은 어쩔수없네요
2182,5,20개월 아기 첫 선크림으로 골라왔어요 잘 맞으면 좋겠어요20개월 아기 첫 선크림으로 골라왔어요 잘 맞으면 좋겠어요
2183,5,나는 눈이 아려서 선크림을 못쓰는 사람이었으나 야외놀이 그린핑거 선크림은 얼마든지 써도 눈 아림이 없이 좋아서 친구에게 선물도 했습니다나는 눈이 아려서 선크림을 못쓰는 사람이었으나 야외놀이 그린핑거 선크림은 얼마든지 써도 눈 아림이 없이 좋아서 친구에게 선물도 했습니다
2184,5,최고예요몇년전부터 이 선크림으로 정착했어요! 이거만한 애가 없네요  다음에 또 구매할게요
2185,4,빨리왔어요 선팩트 써보니까 너무 금방쓰고  선크림보다빨리왔어요 선팩트 써보니까 너무 금방쓰고  선크림보다 못한거같아서 구매합니다
2186,3,정품맞겠죠? 디자인이 약간변경된건지 기존쓰던것과는 조금다르네요 믿고씁니다정품맞겠죠? 디자인이 약간변경된건지 기존쓰던것과는 조금다르네요 믿고씁니다
2187,5,향이랑 발림 좋아요 중학생때부터 쓰던거라 그냥 성인되고도 계속 써요ㅎㅎ향이랑 발림 좋아요 중학생때부터 쓰던거라 그냥 성인되고도 계속 써요ㅎㅎ
2188,5,그린핑거 선크림워낙 유명한거라 인터넷 최저가로구매할수 있어서 좋아요그린핑거 선크림워낙 유명한거라 인터넷 최저가로구매할수 있어서 좋아요
2189,5,역시!!!좋은 제품이라는 거 알고 있었는데 이 가격에 살 수 있어서 너무 좋아요
2190,4,좋아요 배송도 상태도좋아요 배송도 상태도
2191,5,선크림예전에  사용하던  제품유통기한이 거의다되서  또구매하네요저렴해서 구매해요배송도빨랐어요
2192,5,선크림 발림도 좋고 향도 좋아요 쟁기고 쓰려고 3개 주문했어요선크림 발림도 좋고 향도 좋아요 쟁기고 쓰려고 3개 주문했어요
2193,5,아직 안써봤습니다  ㅎㅎㅎ아직 안써봤습니다  ㅎㅎㅎ
2194,5,끈적임도 별로 없고 백탁현상도 적당하고 만족합니다끈적임도 별로 없고 백탁현상도 적당하고 만족합니다
2195,5,만족합니다 믿고 쓰려구요 아이랑 함께 써요만족합니다 믿고 쓰려구요 아이랑 함께 써요
2196,5,항상 쓰는 제품인데 여기가 제일 저렴하네요항상 쓰는 제품인데 여기가 제일 저렴하네요
2197,4,어린이용이라 어쩔수없낭노 백탁이 심해요어린이용이라 어쩔수없낭노 백탁이 심해요
2198,5,올 여름 아들을 햇빛에서 구해줄 구조품 ㅋ올 여름 아들을 햇빛에서 구해줄 구조품 ㅋ
2199,5,좋아요너무느려서ㅜㅜㅜㅜㅜㅜㅜㅜㅜㅜㅜ
2200,5,여름이라 얼굴 팔다리 발라주려고 샀어요여름이라 얼굴 팔다리 발라주려고 샀어요
2201,5,썬크림저렴하고도 많이들 구매하길래 사봤어요
2202,5,배송 빠르고 간편하게 사용하기 좋아요배송 빠르고 간편하게 사용하기 좋아요
2203,5,만족합니다 만족합니다 만족입니다 만족합니다 만족입니다
2204,5,선크림 자극없이 아가들 바르기 좋아요선크림 자극없이 아가들 바르기 좋아요
2205,5,부드럽게 잘 발려서  잘 쓰고있어요부드럽게 잘 발려서  잘 쓰고있어요
2206,5,매번 쓰던거라서 좋아요배송 빨라요매번 쓰던거라서 좋아요배송 빨라요
2207,4,아직 사용전인데 지인소개로 삿어요아직 사용전인데 지인소개로 삿어요
2208,5,배송빠르고  아이거니까   순하겠죠?배송빠르고  아이거니까   순하겠죠?
2209,5,좋아요저렴하게 구입해서 맘에 들어요
2210,4,아직 사용전인데 기대중입니다아직 사용전인데 기대중입니다
2211,4,유효기한 넉넉한  걸로 왔어요유효기한 넉넉한  걸로 왔어요
2212,4,발림도 좋고 가격도 좋아요발림도 좋고 가격도 좋아요
2213,5,배송도 빠르고 제품좋네요배송도 빠르고 제품좋네요
2214,5,아이용으로 구매했어요아이용으로 구매했어요
2215,3,배송이 빨라 좋았습니다배송이 빨라 좋았습니다
2216,4,좋아요 ㅎ ㅎ ㅎ좋아요 ㅎ ㅎ ㅎ
2217,5,작지만 순하고 좋아요 발림도 좋아요작지만 순하고 좋아요 발림도 좋아요
2218,5,순해서 좋아요순해서 좋아요
2219,5,몇년째 쓰고있는 말이 필요없는 ㅋㅋ 막쓰기 제일 좋은 제품입니당몇년째 쓰고있는 말이 필요없는 ㅋㅋ 막쓰기 제일 좋은 제품입니당
2220,5,그린핑거 좋아요사계절 필수템이네요우리 아이들 피부를 지켜준답니다
2221,5,선크림작년에 가격이 너무올라 딴거 사려했는데 예전가격 그래로라 구매했네요 알러지 있는 울애들한텐 딱좋네요
2222,3,배송은 다음날 바로 도착해서 빨랐습니다 다음주 여행가서 쓰려고 샀어요 저렴하고 후기도 좋아 기대됩니다배송은 다음날 바로 도착해서 빨랐습니다 다음주 여행가서 쓰려고 샀어요 저렴하고 후기도 좋아 기대됩니다
2223,4,배송빠르구요아이들 아침마다 바르고 학교가네요배송빠르구요아이들 아침마다 바르고 학교가네요
2224,4,싸게 샀어요기존에 쓰던거 할인하길래 바로샀어요잘 쓸께요
2225,5,여행준비물로팩트썬크림과 함께 구입했는데 여름에 사는것보다 가격이 정말 싼것같아요 괌여행가기전에 팩트 2개와 함께 주문했어요한여름까지 사용가능할것같아요
2226,5,순해서 아이와 함께어른도 이것만 사용해요순해서 아이와 함께어른도 이것만 사용해요
2227,5,조아여아이들이좋아하네요 스스로 해서 편해여
2228,4,편하게 바르기 좋고 발림성도 좋습니다편하게 바르기 좋고 발림성도 좋습니다
2229,4,그린핑거 믿거 써요 아이도 좋아하네요그린핑거 믿거 써요 아이도 좋아하네요
2230,5,잘받았어요필요했는데 저렴하게 구입해서 좋아요
2231,5,좋아요사용하던 제품이라 다시 구입했어요
2232,5,괜찮은거같아요 아직 사용전이지만요괜찮은거같아요 아직 사용전이지만요
2233,5,조아요배송 빨라요여행용으로 구매 했어요
2234,5,잘 받았어요쿠폰적용되서 저렴하게 구매했네요
2235,5,좋아요좋아?B노아요조아요좋아요좋아?B노아요조아요
2236,5,잘받았습니다배송빠르게잘받았어요만족합니다
2237,5,잘쓸게요 배송도 빠르고 잘 왔어여잘쓸게요 배송도 빠르고 잘 왔어여
2238,5,저렴한가격에잘샀어요향도좋네요저렴한가격에잘샀어요향도좋네요
2239,5,아직 사용전 이지만 좋을것같아요아직 사용전 이지만 좋을것같아요
2240,5,늘 쓰던거저렴하게 구입해서 기분 좋네요
2241,5,발림도 좋은편이고 향도 좋아요발림도 좋은편이고 향도 좋아요
2242,5,좋아요 싸게 잘샀어요이런 이벤트 많이해주세요 썬크림 팩 싸게 잘샀네요유통기하 길고 좋네요
2243,5,늘 바르던 제품이라 좋습니다늘 바르던 제품이라 좋습니다
2244,4,이번에 진짜 저렴하게 샀어요이번에 진짜 저렴하게 샀어요
2245,4,야외놀이 선크림야외놀이 선크림조아요추천
2246,5,촉촉하고  아이바르기좋아요촉촉하고  아이바르기좋아요
2247,5,선크림 샀는데 덤도 있어요선크림 샀는데 덤도 있어요
2248,3,저렴하게  잘  산거같아요저렴하게  잘  산거같아요
2249,5,견본은 워시네요잘받았습니다 견본은 워시
2250,5,배송도빠르고 정말좋아요0배송도빠르고 정말좋아요0
2251,5,어머니가 이것만 쓰셔요어머니가 이것만 쓰셔요
2252,5,빠른 배송 만족합니다빠른 배송 만족합니다
2253,5,싸게 잘 샀어요1년마다 바꾸어주어야하는 선크림 큰거 필요없어요싸게 잘 샀어요
2254,5,좋아요저렴하고 좋아요
2255,5,좋아서 만족합니다좋아서 만족합니다
2256,4,늘쓰는제품꾸준히 쓰고 있어요
2257,5,goodgood for you
2258,5,사계절 다 쓴데 좋아요눈이 안맵고 좋아요증정품도 가지고 다니기 좋아 잘 씁니다
2259,4,엄마피부에 발라도 좋네요 끈적임 없고 흡수 잘되고 씻을땐 꼼쏨히 비누로 씻어 주는게 좋을거 같아요 가성비 좋은제품 이라고 생각해요엄마피부에 발라도 좋네요 끈적임 없고 흡수 잘되고 씻을땐 꼼쏨히 비누로 씻어 주는게 좋을거 같아요 가성비 좋은제품 이라고 생각해요
2260,5,괜찮은 것 같아요!! 이제 계속 이제품으로 사용할 것 같습니다!괜찮은 것 같아요!! 이제 계속 이제품으로 사용할 것 같습니다!
2261,5,잘쓸게요 잘쓸게요 잘쓸게요잘쓸게요 잘쓸게요 잘쓸게요
2262,4,트러블없이 괜찮았어요 지울수있는 물티슈가 있어 함께구매하니 더 좋은듯트러블없이 괜찮았어요 지울수있는 물티슈가 있어 함께구매하니 더 좋은듯
2263,4,배송은 며칠 걸렸지만 썬크림이랑 수딩젤 잘왔어요!!아이들이 향기 좋다고 좋아해요!!올여름 잘쓰겠어요배송은 며칠 걸렸지만 썬크림이랑 수딩젤 잘왔어요!!아이들이 향기 좋다고 좋아해요!!올여름 잘쓰겠어요
2264,5,싸고 배송도 빠르네요싸게 사서 좋아요괜찮은거 같아요
2265,4,항상 쓰고 있는 제품이라 재구매 합니다할인 행사 자주 해주었음 좋겠어여항상 쓰고 있는 제품이라 재구매 합니다할인 행사 자주 해주었음 좋겠어여
2266,5,무겁고 미끌거리지 않아 바르는데 아이들 스스로도 잘바릅니다 만족해요무겁고 미끌거리지 않아 바르는데 아이들 스스로도 잘바릅니다 만족해요
2267,5,만족합니다잘 쓰고있습니다감사합니다
2268,5,몇년째 쓰고있어요배송빠르고 좋아요 고등학생아이도 피부트러블  땜시 순한거 쓰네요
2269,5,늘 사용하면서 느끼는거지만 얼굴이 ㅈ독촉하고 광이나요피부에서 광이 난다고 자주 얘기하네요늘 사용하면서 느끼는거지만 얼굴이 ㅈ독촉하고 광이나요피부에서 광이 난다고 자주 얘기하네요
2270,5,아주아주좋아요 아주아주좋아요아주아주좋아요 아주아주좋아요
2271,4,끈적하지 않고 바르면 촉촉하니 좋아요 재구매했어요끈적하지 않고 바르면 촉촉하니 좋아요 재구매했어요
2272,5,항상 쓰는 제품이에요 오여름에도 잘 사용하겠습니다항상 쓰는 제품이에요 오여름에도 잘 사용하겠습니다
2273,5,향이좋아요  아이들 한개씩 주니까 스스로 잘바르네요향이좋아요  아이들 한개씩 주니까 스스로 잘바르네요
2274,5,썬크림썬크림 우리 아이들 피부에 딱 맞는 제품을 만들어
2275,4,좋아요좋아요 좋아요 좋아요 좋아요
2276,5,매번 사용하는매번 사용하는 제품할인해서 착하게 구매했네요
2277,4,요즘같이 자외선지수 높은날 잘 바르고 있어요요즘같이 자외선지수 높은날 잘 바르고 있어요
2278,5,순하고 냄새도 좋고 용량도 크네요 또살게요순하고 냄새도 좋고 용량도 크네요 또살게요
2279,5,아직 써보기 전입니다 평이 좋아서 샀어요아직 써보기 전입니다 평이 좋아서 샀어요
2280,5,몇년째쓰고 있는 막쓰기 좋은 제품입니당몇년째쓰고 있는 막쓰기 좋은 제품입니당
2281,5,처음 사봤는데 향도 좋고 발림성도 좋네요처음 사봤는데 향도 좋고 발림성도 좋네요
2282,5,좋아요봄철대비 미리 구입했어요잘 사용할께요
2283,4,평이 괜찮아서 샀네요아이 봄여름 나드리 준비로 구매했어요
2284,5,가격이너무좋아요 듬뿍바를수있어서가격이너무좋아요 듬뿍바를수있어서
2285,5,배송이 느렸지만 상품은 만족합니다배송이 느렸지만 상품은 만족합니다
2286,4,성인이써도좋아요성인이써도좋아요아이들과함께써요
2287,5,좋아요 아직까직 좀더써봐야알듯좋아요 아직까직 좀더써봐야알듯
2288,5,싸게 제공해 주셔서 감사합니다싸게 제공해 주셔서 감사합니다
2289,5,잘받았어요야외놀이 썬크림 잘 받았어요
2290,5,편하게 몸에 사용하기 좋아요편하게 몸에 사용하기 좋아요
2291,4,선크림물건잘받았읍니다많이파세요
2292,3,작년에도 썼던거라 괜찮이요작년에도 썼던거라 괜찮이요
2293,5,좋ㅇ아요좋ㅇ아요 나중에입어야지요
2294,5,잘받앗습니다싸게 잘삿네요많이파세요
2295,5,항상씁니다 두번째 구매항상씁니다 두번째 구매
2296,5,잘 받았습니다아이들꺼 주문했어요여름에 급하게 주문하는거보다 나은거같아요
2297,3,늘 쓰던대로 재구매해요늘 쓰던대로 재구매해요
2298,5,좋아요봄부터 열심히 쓰려고요
2299,5,그린핑거 늘 쓰고있어요그린핑거 늘 쓰고있어요
2300,5,늘 쓰던 제품입니다 !!늘 쓰던 제품입니다 !!
2301,5,저렴한 가격에 잘 샀어요여름에 쓰려고 샀어요
2302,5,빠르게 잘 받았어요!!빠르게 잘 받았어요!!
2303,5,좋아요선크림 잘받았어요
2304,4,빠른배송 고맙습니다빠른배송 고맙습니다
2305,5,잘 발리고 좋네요!잘 발리고 좋네요!
2306,3,백탁현상이 많네요백탁현상이 많네요
2307,5,좋아요썬크림 좋네요
2308,5,잘받았어요잘받았어요잘받았어요잘받았어요잘받았어요잘받았어요
2309,5,배송은 3일 걸렀어요 후기 좋아서 샀는데 아직 써보진 않았네요 보통 로션에 별 트러블 없으니 잘 맞을거 같아요 샘플은 키즈워시로 2개 유통기한 좋은걸로 잘왔어요배송은 3일 걸렀어요 후기 좋아서 샀는데 아직 써보진 않았네요 보통 로션에 별 트러블 없으니 잘 맞을거 같아요 샘플은 키즈워시로 2개 유통기한 좋은걸로 잘왔어요
2310,5,아이 발라주려 샀는데 저도 얼굴에 막 발라욬ㅋ아이 발라주려 샀는데 저도 얼굴에 막 발라욬ㅋ
2311,5,굿봄부터 발라야죠 잡티예방 아이에게부터
2312,4,원래부터 스던거라 좋아욘 배송은  설날이 겨있긴 했지만 제외하면 34일 정도 걸린 거 같네요 잘 쓸게용원래부터 스던거라 좋아욘 배송은  설날이 겨있긴 했지만 제외하면 34일 정도 걸린 거 같네요 잘 쓸게용
2313,5,유분끼도없고뽀송뽀송잘발리네요아이도좋은냄새난다고좋아하네요그리고서비스로주신썬크림클린저도주시고넘좋았습니다유분끼도없고뽀송뽀송잘발리네요아이도좋은냄새난다고좋아하네요그리고서비스로주신썬크림클린저도주시고넘좋았습니다
2314,3,친정아빠도 외출 하실때 쓰신다고  드렸는데 순하고 촉촉하다고 좋아하시네요애들도 바르니 냄새좋아도 직접 바르고 하네요 다 떨어지면 재구매 하겠습니다친정아빠도 외출 하실때 쓰신다고  드렸는데 순하고 촉촉하다고 좋아하시네요애들도 바르니 냄새좋아도 직접 바르고 하네요 다 떨어지면 재구매 하겠습니다
2315,5,썬크림 좋아요 막 바르기 좋은것 같아요   여름이라 이제 노출이 많아서아이랑 같이  저도 바르고 나가는데  나쁘지않네요
2316,5,잘쓰고있습니다ㅎㅎㅎ잘쓰고있습니다ㅎㅎㅎ
2317,5,아이들에게 사용해도 괜찮네요 끈적임도 없고 아주 좋습니다아이들에게 사용해도 괜찮네요 끈적임도 없고 아주 좋습니다
2318,5,빠른배송과 싼가격사은품까지 챙겨주시고 넘 감사합니다빠른배송과 싼가격사은품까지 챙겨주시고 넘 감사합니다
2319,4,좋아요 아이가 좋아하네요좋아요 아이가 좋아하네요
2320,5,바디용으로 구입했는데 외출시 가지고 다니기 좋아요바디용으로 구입했는데 외출시 가지고 다니기 좋아요
2321,4,마트에서 샀다가 순하길래 아이들 여름나기로 많이 쟁여두고 쓸라고 사뒀습니다 그러다 어른들도 사용중입니다 좋습니다마트에서 샀다가 순하길래 아이들 여름나기로 많이 쟁여두고 쓸라고 사뒀습니다 그러다 어른들도 사용중입니다 좋습니다
2322,5,아이도 엄마도 좋아요아이부터 어른까지 같이쓰게되는 썬크림이네요
2323,5,어른인 저한테도 잘 맞아서 이제품만 사용해요어른인 저한테도 잘 맞아서 이제품만 사용해요
2324,4,선크림아이들 선크림 쓰는겄거의 다되서 구입했네요
2325,5,썬크림많이필요할것같아서 2개주문했습니다
2326,4,아이가 쓰는 첫 선크림이네요순하고 좋아요아이가 쓰는 첫 선크림이네요순하고 좋아요
2327,5,클렌징도 편하고 향도 좋인 구매했어요클렌징도 편하고 향도 좋인 구매했어요
2328,5,워낙 쓰던 제품이예여 포장 꼼꼼해여워낙 쓰던 제품이예여 포장 꼼꼼해여
2329,4,휴가 가느라 급하게 샀는데 아기도 많이 타지 않고 저도 같이 썼는데 순하고 좋네요휴가 가느라 급하게 샀는데 아기도 많이 타지 않고 저도 같이 썼는데 순하고 좋네요
2330,3,싸게구매해서 좋았어요믿고쓸께요싸게구매해서 좋았어요믿고쓸께요
2331,5,항상쓰는제품이에요 순하고좋이여항상쓰는제품이에요 순하고좋이여
2332,4,끈적이지않고 쓰기에 딱 좋습니다끈적이지않고 쓰기에 딱 좋습니다
2333,5,잘 받았어요 아직 사용전이에요잘 받았어요 아직 사용전이에요
2334,5,빨리 배송되고 제품도 좋아요빨리 배송되고 제품도 좋아요
2335,4,사용전 끈적임 없는제품이길사용전 끈적임 없는제품이길
2336,5,항상 구매하는 제품입니다 항상 구매하는 제품입니다 
2337,5,발림성이 좋네요잘쓸깨요발림성이 좋네요잘쓸깨요
2338,5,배송도 빠르고 좋았어요배송도 빠르고 좋았어요
2339,5,아주정말 괜찮앗습니다아주정말 괜찮앗습니다
2340,5,평소 쓰던 제품이에요평소 쓰던 제품이에요
2341,5,좋아요 잘 사용할게요좋아요 잘 사용할게요
2342,5,항상 주문해서 쓰는거항상 주문해서 쓰는거
2343,5,매번 쓰는 제품이예요매번 쓰는 제품이예요
2344,5,끈적임 없이 좋아요끈적임 없이 좋아요
2345,5,잘발리고 산뜻해요잘발리고 산뜻해요
2346,5,여행가서  잘썼어요여행가서  잘썼어요
2347,5,계속쓰던거예요계속쓰던거예요
2348,5,여름이라 구매했는데 좋아요 운동회때 발라줬는데 안탔어요여름이라 구매했는데 좋아요 운동회때 발라줬는데 안탔어요
2349,5,아직 사용전이지만 여름동안 선크림 잘 사용할듯요아직 사용전이지만 여름동안 선크림 잘 사용할듯요
2350,5,맘에들어요맘에들어요 맘에들어요
2351,4,가격 대비 좋은 제품인 것 같습니다 기존부터 쭉 사용하고 있는 제품입니다가격 대비 좋은 제품인 것 같습니다 기존부터 쭉 사용하고 있는 제품입니다
2352,5,매번쓰던거라 주문했어요 저렴하게 안전배송으로 잘 받았습니다 또 사러 올께요매번쓰던거라 주문했어요 저렴하게 안전배송으로 잘 받았습니다 또 사러 올께요
2353,5,여름 준비물여름 준비물여름 준비물여름 준비물여름 준비물
2354,4,좋아요ㅎㅎㅎㅎ ㅎㅎㅎㅎㅎㅎ
2355,5,배송 빨라요 감사합니다배송 빨라요 감사합니다
2356,5,무난하고 괜찮넹다른 제품보다는 트러블이 없어서 재구매합니당
2357,5,백탁현상이 있긴하지만 심하지않고 향도 그렇고 좋아요 아이들용이긴한데 어른이 써도 괜찮은것같아요백탁현상이 있긴하지만 심하지않고 향도 그렇고 좋아요 아이들용이긴한데 어른이 써도 괜찮은것같아요
2358,4,좀 백탁은 있지만 성분 좋아서 잘쓰겠습니다좀 백탁은 있지만 성분 좋아서 잘쓰겠습니다
2359,5,아이들 항상 쓰던제품이라 싸게 구매합니다아이들 항상 쓰던제품이라 싸게 구매합니다
2360,5,늘쓰던거라  아들딸이 이것만 씁니다늘쓰던거라  아들딸이 이것만 씁니다
2361,5,좋아요매일 들고다니면서 사용해요좋아요매일 들고다니면서 사용해요
2362,3,흡수가 잘되고 백택이 없어요흡수가 잘되고 백택이 없어요
2363,4,감사합니다 또주문할께요감사합니다 또주문할께요
2364,5,조아요아아니우우니트투조아요아아니우우니트투
2365,4,늘쓰던거니까 좋겠죵늘쓰던거니까 좋겠죵
2366,5,늘쓰던 제품 좋아요늘쓰던 제품 좋아요
2367,5,순하고 잘 발려요순하고 잘 발려요
2368,5,좋아요정말 좋아요좋아좋아좋아요
2369,5,좋아요좋아요 좋아요 정말좋아요
2370,5,늘 사용하는 제품입니다온가족 다같이 사용해요늘 사용하는 제품입니다온가족 다같이 사용해요
2371,5,순하고 향도 좋고 발림성도 좋고 몇 통째 쓰고있어요순하고 향도 좋고 발림성도 좋고 몇 통째 쓰고있어요
2372,5,이것만 씁니다 항도 은은하고 잘 씻기고 좋습니다이것만 씁니다 항도 은은하고 잘 씻기고 좋습니다
2373,5,좋아여애기꺼지만 좋아서 제가써요ㅎㅎ 늘쓰던제품 빠른배송 감사해요
2374,5,순하고 발림성도 좋더라구요 해외여행가서 잘 쓰고 왔습니다 아기 피부에도 잘 맞았어요순하고 발림성도 좋더라구요 해외여행가서 잘 쓰고 왔습니다 아기 피부에도 잘 맞았어요
2375,5,로션타입이라 아이들이바르기도 쉽고 백탁도적어서 쓰기편해요로션타입이라 아이들이바르기도 쉽고 백탁도적어서 쓰기편해요
2376,2,배송은 빠르지 않았어요 첨처보는대 향이잇네요배송은 빠르지 않았어요 첨처보는대 향이잇네요
2377,5,아이들 야외놀이용으로 구입했어요 좋네요아이들 야외놀이용으로 구입했어요 좋네요
2378,5,자극이적고 적당히 화사하게 해줘서 좋아요자극이적고 적당히 화사하게 해줘서 좋아요
2379,4,야외차단력도 좋고 발림성도 좋으네요야외차단력도 좋고 발림성도 좋으네요
2380,5,늘 사용하던거에요 퍼프로 찍어쓰는건 위생적으로 찜찜해서 아이 얼굴에 바를꺼라 손으로 톡톡 발라주는걸로 구입했어요늘 사용하던거에요 퍼프로 찍어쓰는건 위생적으로 찜찜해서 아이 얼굴에 바를꺼라 손으로 톡톡 발라주는걸로 구입했어요
2381,4,늘 쓰는 제품입니다 만족합니다늘 쓰는 제품입니다 만족합니다
2382,4,지인 추천으로 구매했어요잘펴발라지고 좋긴한데 잘 지워지는게 단점이네요 물놀이 할땐 자주 덧발라야겠어요지인 추천으로 구매했어요잘펴발라지고 좋긴한데 잘 지워지는게 단점이네요 물놀이 할땐 자주 덧발라야겠어요
2383,4,순하고좋아요 순하고 좋아요순하고좋아요 순하고 좋아요
2384,4,배송빠르고 발림좋네요 차단도 잘되겠죠!?배송빠르고 발림좋네요 차단도 잘되겠죠!?
2385,4,항상 쓰는거예요가족이 다 쓰기 좋아요항상 쓰는거예요가족이 다 쓰기 좋아요
2386,4,배송도 빠르고 발림성 좋고 괜찮아요배송도 빠르고 발림성 좋고 괜찮아요
2387,4,백탁현상 없이 발림성이 너무 좋네요백탁현상 없이 발림성이 너무 좋네요
2388,4,촉촉하니 여전히 사용감이 좋네요촉촉하니 여전히 사용감이 좋네요
2389,5,아이도 불편함없이 잘 썼어용ㅎㅎ아이도 불편함없이 잘 썼어용ㅎㅎ
2390,3,아직 써보진 않았지만 잘 쓸게요아직 써보진 않았지만 잘 쓸게요
2391,4,매번쓰는제품이라 또 구매했어요매번쓰는제품이라 또 구매했어요
2392,5,배송도 상품도 너무 만족합니다배송도 상품도 너무 만족합니다
2393,5,가격이 저렴해서 만족했어요가격이 저렴해서 만족했어요
2394,5,매번 쓰는 상품인데 좋아요매번 쓰는 상품인데 좋아요
2395,5,너무 좋아욤 배송도 빨라요너무 좋아욤 배송도 빨라요
2396,5,빠른배송 정말 좋았습니다빠른배송 정말 좋았습니다
2397,4,배송이 빨라서 좋았습니다배송이 빨라서 좋았습니다
2398,5,좋은 상품 잘 받았습니다좋은 상품 잘 받았습니다
2399,5,배송도빠르고너무좋아요배송도빠르고너무좋아요
2400,5,항상 쓰던 상품이에요항상 쓰던 상품이에요
2401,5,순하고 바르기 좋아요순하고 바르기 좋아요
2402,5,늘쓰던것 좋습니다늘쓰던것 좋습니다
2403,5,자외선 차단제굿!!자외선 차단제굿!!
