,평점,본문
1496,5,순해서 어른이지만 계속 사용하고 있어요지금까지 10개는 넘게 사용한 것 같아요지금은 중고생 아들 딸도 같이 사용하고 있어요유통기한도 2021년 11월까지라서 넉넉하네요가격순해서 어른이지만 계속 사용하고 있어요지금까지 10개는 넘게 사용한 것 같아요지금은 중고생 아들 딸도 같이 사용하고 있어요유통기한도 2021년 11월까지라서 넉넉하네요가격도 저렴해서 더 좋습니다
1497,3,이것만 거의 뭐 10통은 넘게 쓴거 같아요 근데 전에는 깔끔하게 잘 발리던데 요즘에는 약간 기름기가 도네요ㅠ이것만 거의 뭐 10통은 넘게 쓴거 같아요 근데 전에는 깔끔하게 잘 발리던데 요즘에는 약간 기름기가 도네요ㅠ
1498,5,좋아요만족합니다 감사합니다
1499,5,몇년째 쓰는 제품입니다민감한 아들 전용입니다몇년째 쓰는 제품입니다민감한 아들 전용입니다
1500,5,잘받았구요약간의 차질이 있었지만잘 쓰라구보내신거 즐겁게 받았습니다
1501,3,늘사용하는제품이에요 하옇게 뜨지도 않고 만족스러워요늘사용하는제품이에요하옇게 뜨지도 않고 만족스러워요
1502,4,매번 쓰던 대로 향도 좋고 백탁도 엄청 심하지 않아요매번 쓰던 대로 향도 좋고 백탁도 엄청 심하지 않아요
1503,4,늘사용하던가라  믿고 재구매  잘쓰고 있습니다늘사용하던가라  믿고 재구매  잘쓰고 있습니다
1504,5,좋아요싸게 구매했어요아이들이 사용하기 좋습니다
1505,3,데일리로 무난하게 사용하기 좋습니다데일리로 무난하게 사용하기 좋습니다
1506,3,선크림의 발리는 감이 부드러워요 ㅎ선크림의 발리는 감이 부드러워요 ㅎ
1507,5,항상 쓰는 건데 자극도 적고 좋아요항상 쓰는 건데 자극도 적고 좋아요
1508,3,좀오래두드려야하는단점은있네요좀오래두드려야하는단점은있네요
1509,5,아직보지는못했는데괜찮겠죠아직보지는못했는데괜찮겠죠
1510,5,야외놀이 나갈때 좋아요야외놀이 나갈때 좋아요
1511,5,물놀이 용으로 샀어요물놀이 용으로 샀어요
1512,4,가성비 최고에요 굿굿가성비 최고에요 굿굿
1513,5,써게 잘샀어오 굿굿써게 잘샀어오 굿굿
1514,5,딸들이 사용고딩인데도 이 썬크림을 사용하네요 ㅎㅎ 꾸준히 이거만 사용하고 있어요
1515,5,배송도 빠르고 유통기한도 길고우선 여기가 젤 싼것 같아요잘 쓰겠습니다배송도 빠르고 유통기한도 길고우선 여기가 젤 싼것 같아요잘 쓰겠습니다
1516,5,배송이 빠르고 저렴함저렴한 가격으로 우리 가족 피부관리를 할 수 있어서 좋아요온 가족이 같이 사용해도 좋은 브랜드임
1517,5,자극이 적어서 우리아이가 좋아해요 휴대하기 적당한 크기예요자극이 적어서 우리아이가 좋아해요 휴대하기 적당한 크기예요
1518,5,자극이 없고 부드러워 아이에게 사용하기  좋습니다자극이 없고 부드러워 아이에게 사용하기  좋습니다
1519,5,바르면 살짝 뽀샤시 해져요ㅋㅋ잘 쓰고있습니다바르면 살짝 뽀샤시 해져요ㅋㅋ잘 쓰고있습니다
1520,5,써보니깐 순하고 좋아서 사길 잘한 것 같아요!!써보니깐 순하고 좋아서 사길 잘한 것 같아요!!
1521,5,어떤 피부에도 사용가능한거 같아서 좋아요어떤 피부에도 사용가능한거 같아서 좋아요
1522,5,잘샀어요늘 쓰던거예요그리고 사은품이 엄청나네요받고 깜놀했어요원래는 비치볼을 보내주셔야하는데 물티슈가 왔지만 그게 더 맘에 드네요 잘 쓸께요
1523,5,배송빠르고 포장 꼼꼼히니 좋아요배송빠르고 포장 꼼꼼히니 좋아요
1524,5,순해서 온가족이 사용했습니다 순해서 온가족이 사용했습니다 
1525,5,자극없고 좋아요민감피부 아이가 쓰는데 좋아요
1526,5,좋아요그린핑거 선크림 너무 좋아요
1527,5,선크림선크림 잘 받았습니다
1528,5,최고예요늘  쓰는 제품입니다
1529,4,빨라요빠른배송 감사합니다
1530,4,사이즈가 작긴 작네요 간편하게 쓸수 있어서 좋은거 같아요사이즈가 작긴 작네요 간편하게 쓸수 있어서 좋은거 같아요
1531,3,가격도 저렴하고 화해 어플에서 추천이 많아서 사용해봐요가격도 저렴하고 화해 어플에서 추천이 많아서 사용해봐요
1532,5,배송이 빨랐어요아직써보지않았는데 리뷰처럼 좋겠죠?배송이 빨랐어요아직써보지않았는데 리뷰처럼 좋겠죠?
1533,5,늘 쓰던거에요배송도 빠르고 좋네요 잘쓸게여늘 쓰던거에요배송도 빠르고 좋네요 잘쓸게여
1534,5,늘 쓰던 제품입니다 좋아요늘 쓰던 제품입니다 좋아요
1535,4,항상 쓰던 제품이에요항상 쓰던 제품이에요
1536,5,아이들이 좋아해요 최고아이들이 좋아해요 최고
1537,5,걍 항상 무난무난해서 잫쓰고 있습니당 ㅎㅎ잘써요걍 항상 무난무난해서 잫쓰고 있습니당 ㅎㅎ잘써요
1538,4,좋아요초등 딸아이들이 쓰는제품입니다순하고 향도 거의 없어서 잘 쓰고 있어요유통기한 21년 11월까지네요
1539,5,가격대비좋아요좋아요가격대비좋아요좋아요가격대비좋아요좋아요
1540,4,마음에들어요마음에들어요같이보내준 볼은 바람이 빠지네요재구매할께요감사합니다
1541,5,아직 많이사용안해봤지만 좋은거같아요담달에 해외여행갈때사용하려고 주문했습니다아직 많이사용안해봤지만 좋은거같아요담달에 해외여행갈때사용하려고 주문했습니다
1542,5,유통기간도 넉넉하보 좋아요  저렴하게 잘 구입했어요!!유통기간도 넉넉하보 좋아요  저렴하게 잘 구입했어요!!
1543,3,발림성이좋은덕좀오래문질러야백탁현상이사라져요발림성이좋은덕좀오래문질러야백탁현상이사라져요
1544,5,항상 쓰던 제품인데 저렴하게 잘 구매했습니다항상 쓰던 제품인데 저렴하게 잘 구매했습니다
1545,5,양도 많고 저렴히 샀어요아이들 잘 쓰고 있어요
1546,4,좋아요감사합니다
1547,5,가성비 최고 빠른 배송 좋아요늘 쓰던거라 또 구매해 사용합니다 빠른 배송에 굿입니다
1548,4,배송도 빠르고 잘받았어요ㅎㅎ배송도 빠르고 잘받았어요ㅎㅎ
1549,5,기존 사용했는데 좋아서 재구매했습니다발림성이 좋고 번지는것도 없어서 재구매했습니다
1550,4,가격대비 무난하네요향도좋고 발림성도 좋아요가격대비 무난하네요향도좋고 발림성도 좋아요
1551,4,딸아이가  쓸건데  아주 순하고 향도 조아요딸아이가  쓸건데  아주 순하고 향도 조아요
1552,5,맘에들어서 여러개 샀습니다 이거밖에안써용맘에들어서 여러개 샀습니다 이거밖에안써용
1553,5,저렴한가격에 잘구매해서 잘사용하고있습다저렴한가격에 잘구매해서 잘사용하고있습다
1554,5,배송빠르구요 저렴하게 잘 구입한거 같아요배송빠르구요 저렴하게 잘 구입한거 같아요
1555,5,야외활동할때 편하게 잘 발려서 좋네요야외활동할때 편하게 잘 발려서 좋네요
1556,4,좋아요 트러블없이 잘사용하고 있어요좋아요 트러블없이 잘사용하고 있어요
1557,4,좋아요 트러블없이 잘사용중이에요좋아요 트러블없이 잘사용중이에요
1558,5,유통기한도 넉넉하고 싸고 좋아요유통기한도 넉넉하고 싸고 좋아요
1559,5,아이가 편안하게 사용했어요아이가 편안하게 사용했어요
1560,5,좋아요배송 빠르고 저렴하게 잘샀네요
1561,5,배송 빠르고 제품도 괜찮네요배송 빠르고 제품도 괜찮네요
1562,5,쓰던거에여 잘받았습니다쓰던거에여 잘받았습니다
1563,5,부드럽게 발림이  좋아요부드럽게 발림이  좋아요
1564,5,배송도엄청! 빠릅니다  유통기한도 넉넉하구요 화장품 앞부분 상단에는 제조일자이고 뒷부분 상단에 유통기한인가봐요ㅋㅋ혹시 저처럼 착각하는분 계실까봐 적어둡니다 수고하세요배송도엄청! 빠릅니다  유통기한도 넉넉하구요 화장품 앞부분 상단에는 제조일자이고 뒷부분 상단에 유통기한인가봐요ㅋㅋ혹시 저처럼 착각하는분 계실까봐 적어둡니다 수고하세요
1565,5,가격 저렴히 넘  잘 샀어요! 2개씩 샀는데 유통기한도 21년까지라 넉넉해서 올해 내년 나눠써도 충분할듯해요 잘 쓸게요가격 저렴히 넘  잘 샀어요! 2개씩 샀는데 유통기한도 21년까지라 넉넉해서 올해 내년 나눠써도 충분할듯해요 잘 쓸게요
1566,5,아기썬크림 딱 떨어져서 곤란했는데 저렴한 가격에 넘  잘 샀어요 썬스틱이 투명이라 좋네요향도 은은해요아기썬크림 딱 떨어져서 곤란했는데 저렴한 가격에 넘  잘 샀어요 썬스틱이 투명이라 좋네요향도 은은해요
1567,5,좋아요좋아요좋아좋아좋아요좋아요좋아좋아
1568,5,피부커버되서 좋아요아이들제품이라 믿고 구매해요 번들거리지않고 피부커버도 되서 좋아요
1569,3,온가족 다쓰고 있어요 반통썼어요 물에 안지워지는건 아닌거 같은데 물놀이해도 확실히 덜탑니다온가족 다쓰고 있어요 반통썼어요 물에 안지워지는건 아닌거 같은데 물놀이해도 확실히 덜탑니다
1570,4,잘받았어요박스 에 잘 포장되어 왔어요 감사합니다 재구매하러올께요
1571,4,나쁘지않은걱갘앙요 더써바야알겟지만요나쁘지않은걱갘앙요 더써바야알겟지만요
1572,4,스벅기프트카드조아요잘받앗어요 스벅카드줘서 더조아요
1573,4,잘받앗어요 여름필수품이라 구매햇어요 조아요
1574,4,늘쓰던거에요저렴하게샀네요늘쓰던거에요저렴하게샀네요
1575,5,무기자차 항상 쓰던거에요무기자차 항상 쓰던거에요
1576,5,쓰던건데 싸게 잘샀네요쓰던건데 싸게 잘샀네요
1577,5,몇년째이 브랜드  잘 씁니다
1578,5,매번 사옹하는거라 아이들이 좋아해요 올 해도 사계절 모두 사용해요매번 사옹하는거라 아이들이 좋아해요 올 해도 사계절 모두 사용해요
1579,5,향도 좋고 괜찮네요향도 좋고 괜찮네요
1580,5,또 구입했어요아직 쓰던것이 남아있지만 가격혜택이 좋아 미리 구입했어요아이가 아침마다 잊지않고 잘 바르고 있습니다손바닥에 묻긴해도 제일 편하게 쓱 바를 수 있어 좋아요
1581,5,상품배송만족아기때부터  쓰고있어요 향도좋고 제품도좋아요
1582,4,타 브랜드 제품 쓰다 발림성이 너무 않좋아 구매 했는데 부드럽게 잘 발려요 이각격에 두개나 오고 복숭아 향 난다고 아이가 좋아 하네요ㅎㅎ타 브랜드 제품 쓰다 발림성이 너무 않좋아 구매 했는데 부드럽게 잘 발려요 이각격에 두개나 오고 복숭아 향 난다고 아이가 좋아 하네요ㅎㅎ
1583,4,이전에 써봤는데 전 성인이지만 베이스 선크림으로 좋더라구요 약간 백탁이 있는데 전 그게 더 좋아서 씁니다 부드럽고 순한 느낌이예요이전에 써봤는데 전 성인이지만 베이스 선크림으로 좋더라구요 약간 백탁이 있는데 전 그게 더 좋아서 씁니다 부드럽고 순한 느낌이예요
1584,3,아이들과 함께  써요늘 사용하던  제품인데  어찌된게  아이들도  엄마도 좀  건조해서  피부가 당긴다네요  전엔  그렇지 않았는데
1585,5,ㄱㅡㅇㄴㄴ59ㅋ8ㄴ낭4ㅇ8년4ㅓㄴ6ㄷㄴO디ㄱㅡㅇㄴㄴ59ㅋ8ㄴ낭4ㅇ8년4ㅓㄴ6ㄷㄴO디
1586,3,배송은 괜찮았는데 안에 뾱뾱이도 아니고 신문지를 넣어서 보냈네요ㅜ배송은 괜찮았는데 안에 뾱뾱이도 아니고 신문지를 넣어서 보냈네요ㅜ
1587,4,백탁없이 괜찮네요끈적임 없고 백탁없이 잘 발리네요 향도 복숭아향 나고 좋아요
1588,5,감사합니다 잘 받았습니다감사합니다 잘 받았습니다
1589,5,아이들 쓰기에 괜찮은거같아요 만족하고 쓰고있어요아이들 쓰기에 괜찮은거같아요 만족하고 쓰고있어요
1590,5,너무 좋아요정말 저렴하고 배송도 빠르고 좋아요강력 추천합니다
1591,5,애들 썬크림은 항상 이거만 쓰네요피부에도 순한거같고 애들 썬크림은 항상 이거만 쓰네요피부에도 순한거같고 잘맞습니다이번 여름도 울애들 피부지킴이 ㅎㅎ
1592,5,gasgdawdgfasgwaeggasgdawdgfasgwaeg
1593,5,순해서 60대 저희 아빠는 요것만 쓰세요순해서 60대 저희 아빠는 요것만 쓰세요
1594,5,항상 이제품만 쓰는데 좋은것 같습니다항상 이제품만 쓰는데 좋은것 같습니다
1595,5,감사합니다제 아이에겐 안 맞지만 괜찮은듯 해요
1596,5,잘받았어요 아직 사용 전이긴하네요잘받았어요 아직 사용 전이긴하네요
1597,4,계속 쓰는 상품재구매순하고 좋아요계속 쓰는 상품재구매순하고 좋아요
1598,5,빨리 와서 좋네요 잘쓸게요빨리 와서 좋네요 잘쓸게요
1599,5,좋네요 잘발리고ㅎㅎ또사야지좋네요 잘발리고ㅎㅎ또사야지
1600,5,손으로 펴 발라주는게 좋아요손으로 펴 발라주는게 좋아요
1601,5,좋아요상품이 좋은것 같습니다
1602,5,저렴하게 구입했네요저렴하게 구입했네요
1603,5,좋아요백탁도없고향좋아요
1604,4,올여름 잘썼어요올여름 잘썼어요
1605,1,와사진만보다 낚였네요 그냥 주는줄 알았더니 2세트 사야준다니 ㅡㅡ 글 제대로 못읽은 나도 잘못이지만진짜 낚시성사진인듯 ㅡㅡ
1606,4,늘 쓰는 썬블럭아이들 쓰기에 순하고 신랑도 같이 쓰는썬블럭 크림자외선 지수 높은 요즘 아이들 위해 외출 전에 꼭 발라줘요용량이 더 많아졌으면 좋겠어요굿굿
1607,3,저렴하게 샀어요할인 받아서 다른 곳 보다 조금 저렴해요향 좋고 발림성 좋으나 약간 끈적이고 번쩍여요
1608,5,가격도 저렴하고 배송도 금방왔어요! 유통기한도 넉넉해서 좋네요 매번쓰던 제품이라서 만족하고 사용합니다가격도 저렴하고 배송도 금방왔어요! 유통기한도 넉넉해서 좋네요 매번쓰던 제품이라서 만족하고 사용합니다
1609,5,항상100프로만족하는 썬크림항상100프로만족하는 썬크림
1610,4,아들이 외출할때마다 듬뿍 발라주고요오프라인 매장보다 아들이 외출할때마다 듬뿍 발라주고요오프라인 매장보다 싸게구입해서좋아요
1611,5,선크림그린핑거선크림 좋은가격에 구입하게되어 좋아요향도 좋네요
1612,3,배송문제만 빼면 괜찮아용평소에 쓰던크림입니다배송문제만 빼면 괜찮아용평소에 쓰던크림입니다
1613,5,최고에요저렴하게 잘 샀어요 물놀이할때 유용할것 겉아요
1614,5,배송 빨라요발림이 나쁘지않고 좋네요 가격대비 만족합니다
1615,5,성인인데 인생선크림이에요 끈적임적고순해요성인인데 인생선크림이에요 끈적임적고순해요
1616,5,흡수잘됨흡수잘되고 백탁현상 심하지 않아서 좋아요
1617,5,늘 사용하는제품 저렴하게 잘 구매했네요늘 사용하는제품 저렴하게 잘 구매했네요
1618,4,배송빠르고좋네요 팝핑보바는 맛없어요배송빠르고좋네요 팝핑보바는 맛없어요
1619,5,야외놀이그린핑거 선크림 순하고 발림성 좋아요
1620,5,좋음원래 쓰던 제품이어서요 ! 좋습니다 
1621,5,잘받았습니다배송도 빠르고 저렴하게 구매했네요
1622,4,선크림끈적임없이 깔끔해요만족합니다
1623,5,잘받았어요 배송도 빠르고 물건도 맘에들어요
1624,4,아직 미사용이지만 무기자차유기자차 혼합이라 그나마 순한데 차단도 잘 된다고 해서 구매했네요아직 미사용이지만 무기자차유기자차 혼합이라 그나마 순한데 차단도 잘 된다고 해서 구매했네요
1625,5,잘받았어요올여름 넉넉하게 쓸수있겠네요
1626,5,좋아요배송 빠르고 상품 만족합니다
1627,5,항상쓰던것좋아요 미백효과도있구요
1628,5,빨라요팔리 왔네요 잘 쓸께요
1629,5,순해서아이들과같이써요순해서아이들과같이써요
1630,5,아직 사용전아직 사용전이긴하나 용량도 딱 좋고온가족용으로 사용예정이예요
1631,4,좋아요 만족합니더좋아요 만족합니더
1632,5,좋아요넘좋아요
1633,5,성인인데 피부가 약해 순한걸 찾다가 몇통째 쓰고 있습니다 저렴하게 구매했습니다성인인데 피부가 약해 순한걸 찾다가 몇통째 쓰고 있습니다 저렴하게 구매했습니다
1634,5,포장도 잘되오고 저렴하게 구매해서 좋았습니다! 향도 좋고 뭔가 그 찐득한 느낌 없어서 좋았습니다!  잘쓸게요포장도 잘되오고 저렴하게 구매해서 좋았습니다! 향도 좋고 뭔가 그 찐득한 느낌 없어서 좋았습니다!  잘쓸게요
1635,4,마트보다 싸요마트보다 저렴하게 샀어요 아직 사용전이지만 많이들 쓰니까 괜찮겠죠뭐 ㅋㅋ 애들 발라주면서 저도 바르려구요
1636,5,이것만써요향도좋고 발림성좋고 끈적이지않아요
1637,5,너무 싸게 사서 좋아요!!!늘 쓰던거에요순해서 온몸에 바르기 좋아요너무 싸게 사서 좋아요!!!늘 쓰던거에요순해서 온몸에 바르기 좋아요
1638,4,잘쓰겠습니다만족합니다 상태양호 잘쓰겠습니다
1639,5,향이 좋데요좋은 기회에 구매했는데 아이가 향이 좋다며 행복한 미소를 보이네요 감사히 잘 쓸께요
1640,4,우리아이가 잘쓰고있어요ㅎㅎ우리아이가 잘쓰고있어요ㅎㅎ
1641,5,가성비좋아요 매번쓰던겁니다가성비좋아요 매번쓰던겁니다
1642,5,좋아요가격대비만족합니다 좋아요
1643,5,순해서 매일 쓰고 있어요순해서 매일 쓰고 있어요
1644,5,배송 빨라요 감사해요배송 빨라요 감사해요
1645,4,사용하기 편해용사용하기 편해용
1646,5,늘 쓰던거입니당늘 쓰던거입니당
1647,5,항상 사용하는 썬크림어른인 제가 쓰지만 이것만 사용해요항상 사용하는 썬크림어른인 제가 쓰지만 이것만 사용해요
1648,5,좋아요아이들  피부에는 아이용 썬크림이 맞는  거 같아서 샀어요
1649,5,잘받았어요그린핑거 썬크림 두 개 주문했어요그린핑거시리즈는 산뜻하고 향이 좋아요잘쓸게요
1650,5,물건 맘에들고요 잘받았습니다 많이파세요 재구매의사있습니다물건 맘에들고요 잘받았습니다 많이파세요 재구매의사있습니다
1651,4,화장하기  전에 쓰는데 좋아요 화장도 안 밀리고화장하기  전에 쓰는데 좋아요 화장도 안 밀리고
1652,5,바르던거어린이집 둘째도 들어가서 미리 구매했어요사은품 감사합니다
1653,4,7살 딸아이가 사용하는 제품이에요부드럽게 잘 발라지7살 딸아이가 사용하는 제품이에요부드럽게 잘 발라지고 가격도 저렴에서 자주 구매하고 있어요
1654,5,좋아요좋아요좋아요ㅋ좋아요좋아요좋아요ㅋ
1655,5,6년째 쓰고있어요 굿6년째 쓰고있어요 굿
1656,5,아이부터 어른까지 사용가능한거라 온가족이 이것만 쓰고 있어요아이부터 어른까지 사용가능한거라 온가족이 이것만 쓰고 있어요
1657,5,배송도빠르고 구성도 맘에들어요배송도빠르고 구성도 맘에들어요
1658,5,촉촉 보숩 효과도 있는 데 사야죠촉촉 보숩 효과도 있는 데 사야죠
1659,5,좋아요순하고 자외선차단잘되요좋아요순하고 자외선차단잘되요
1660,5,감사합니다안녕하세요감사합니다 11 너무   좋아요
1661,3,백탁 없을줄 알았는데 아주 없지는 않아요 그런데 자외선차단 효과는 좋으네요백탁 없을줄 알았는데 아주 없지는 않아요 그런데 자외선차단 효과는 좋으네요
1662,5,좋아요식구들이 많아서 많이필요했는데 저렴한 가격에 아주 좋습니다 또 구입할께요
1663,4,향도 좋고 백탁약간 있는게  화학성품 이  덜 들어있데서 쓰고있어요  괜찮아요향도 좋고 백탁약간 있는게  화학성품 이  덜 들어있데서 쓰고있어요  괜찮아요
1664,5,배송 빨라요발림성도 좋고 지우기도 편해요다른제품으로 바꿨다가 낭패보고 다시구매함ㅠ
1665,5,순해서 좋아요순한 썬크림 사용해야 하는 사람에게 좋은 제품이죠 가격도 만족스럽네요
1666,5,잘 받았어요크기에 비해 너무 과대포장 아닌가요 ㅎㅎㅎ잘 쓸게요 감사합니다
1667,5,몸에바르려고 샀어요 배송빠르고 좋네요올여름 잘 사용할게요
1668,5,여름이 왔으니까스틱도 쿠션도 좋지만물놀이 이럴때 팔이고 목이고 슥슥 막 발라줄땐 크림도 좋더라구요ㅎ
1669,4,3통째 쓰고있는데 냄새도 좋고 적당히 촉촉해서 좋아요3통째 쓰고있는데 냄새도 좋고 적당히 촉촉해서 좋아요
1670,5,여기것만 써요순하고 부드럽게 잘발려서 여기것만 사게 됩니다
1671,5,좋습니다앞으로 이 제품만 사용할 듯 싶어요ㅎ좋습니다앞으로 이 제품만 사용할 듯 싶어요ㅎ
1672,5,좋아요저렴하게  구매  팔에  바르고  있는데좋아요
1673,5,휴가때 쓸려고 미리 사뒀는데 좋은거 같아요휴가때 쓸려고 미리 사뒀는데 좋은거 같아요
1674,5,최고예요빠른 배송에 저렴한가격에 매우 만족합니다
1675,5,좋아요저렴한 가격에 잘 샀어요 잘 사용하겠습니다
1676,5,늘 쓰던거예요향기도 좋고 가격도 착하게 사서 더 좋네요
1677,2,백탁이 좀있어요워터프루프는아니네요백탁이 좀있어요워터프루프는아니네요
1678,4,제품발림도 좋고 냄새도 향긋하고  좋아요
1679,5,넘 맘에 들어요행사해서 저렴하게 구입했어요2021년까지라 넉넉하게 쓸 수 있어 좋네요
1680,5,아이들이 사용하기 ㅗㅎ은 제품 아이들이 사용하기 ㅗㅎ은 제품 입니다
1681,4,믿고 샀어요요즘 아침마다 꼼꼼이 바르고 등원해요
1682,5,썬크림순해서 가족이 모두 같이 쓰고 있어요
1683,4,애용합니다썬쿠션도 잘쓰고 썬크림도 잘 쓸께요
1684,3,효과는 아직모르겠고 괜찮은거같아요효과는 아직모르겠고 괜찮은거같아요
1685,5,쓰던제품이라 만족하며 쓰고있습니다쓰던제품이라 만족하며 쓰고있습니다
1686,5,늘 쓰던 제품이에요저렴하게 구입늘 쓰던 제품이에요저렴하게 구입
1687,5,쪼아요매년 구매해요  잘 쓰겠습니다  ㅋ
1688,4,잘받았어요좀전에받았습니다 매일발라야겠어요
1689,5,좋아요배송도 빠르고 계속 쓰는제품이네요
1690,5,글쎄요아직 사용전이라배송은 빠른데
1691,4,좋아요 오늘 처음사용 했어요 좋아요
1692,5,좋아요여름대비 꼬맹이꺼 구매했어요
1693,5,좋아요저렴하게 잘 구매한 거 같아요
1694,5,날이 더워샀어요마트보다 훨씬싸게 샀어요
1695,5,아기 물놀이 할때 발라줫어요아기 물놀이 할때 발라줫어요
1696,5,조아요저렴한 가격에 득템이네요
1697,5,필요해서구매해요조아요필요해서구매해요조아요
1698,4,좋아요배송받은 상품 만족해요
1699,5,아이들 야외활동야외활동 걱정 없겠어요
1700,5,향이 달콤하고 좋아요 ㅎ향이 달콤하고 좋아요 ㅎ
1701,4,배송은 빠라서 좋았습니다 냄새도 과하지 않아서 좋아요아직 사용 안해봐서 별하나 뺐습니다배송은 빠라서 좋았습니다 냄새도 과하지 않아서 좋아요아직 사용 안해봐서 별하나 뺐습니다
1702,5,애들이너무 좋다 하네요애들이너무 좋다 하네요
1703,5,11저렴하게 잘산것 같애요
1704,5,무난합니다가격도 기능도 만족해요
1705,5,항상쓰던거2개에 이가격 괜찮네요
1706,5,잘 구입했어요애들 발라주고 좋아요
1707,5,좋아요저렴하게 구입했어요
1708,5,좋아요믿고믿고 자주시켜씁니다
1709,4,순해서 좋네용!!!순해서 좋네용!!!
1710,3,잘받았어요발림성도 좋은편이고 향도 좋은편이라 이 상품을 쭉 써요
1711,5,우리 애들 선크림은 언제나!특가로 가격 저렴하게 빠르게 배송되었네요!꾸준히 매번 재주문해서 이용합니당
1712,4,좋아요가성비 좋아요 ㅎㅎㅎ 그린핑거라 안심이 되네요
1713,5,좋아요애들이 둘이라 썬크림도 금방써지는데 하나더 구입할수 있으니 좋네요올해는 야외 활동 많이할거라 부족할지도 모르겠네요또 구입하러올께요
1714,5,좋아요 만족합니다 배송 빠릅니다좋아요 만족합니다 배송 빠릅니다항상 쓰고 있는 제품입니다
1715,5,좋아용선크림이 너무 가볍고 좋네요그린핑거여서 느낌과 향기가 좋아욤11 80밀리강추 입니다
