,평점,본문
668,5,올여름 잘 쓸 것 같아요!올여름 잘 쓸 것 같아요!
669,4,잘받았습니다아직 사용전이지만  가족 모두 함께 사용하기 좋을듯 하네요  잘쓸께요
670,5,썬크림야외놀이 썬크림 매번 요것만 사용합니다아들 6학년인데 아직까지는 좋네요잘받았습니다 잘받았습니다 잘받았습니다
671,4,좋아요향도 괜찮고 끈적끈적한 느낌도 없어서 바르기 좋아요
672,5,옥션이 제일 저렴해서 구매했습니다 예전에 사용했었던 제옥션이 제일 저렴해서 구매했습니다 예전에 사용했었던 제품이라 다시 써보려고 구매했는데 만족합니다 ! 11이어서 하나는 제가 쓰고 하나는 엄마 드렸네요ㅎㅎ
673,5,좋아요올여름 잘쓸게요 사홋귿솧늣ㅇㄱㄷㅅㄴㅅㅇㄴㄷ
674,5,여름되면 늘 구매아빠 엄마 누나 동생 모두 함께 사용해요발림도 좋고 톤업되는 기분도 둘고여름되면 늘 구매아빠 엄마 누나 동생 모두 함께 사용해요발림도 좋고 톤업되는 기분도 둘고
675,5,이제품 출시부터 써오고 있어요그린핑거가 우리 첫째가 아기였을때 런칭 되었는데 야외놀이 썬로션 나올때부터 첫째 중딩된 지금까지 쓰고 있어요순하고 차단력도 있는거 같아요 향도 좋구요 사은품도 감사합니다
676,5,배송빠르고 포장 꼼꼼히잘해주셧어요늘쓰는제품이라 저렴하게 잘구입했어요 유동기한 넉넉한제품 잘쓸게요배송빠르고 포장 꼼꼼히잘해주셧어요늘쓰는제품이라 저렴하게 잘구입했어요 유동기한 넉넉한제품 잘쓸게요
677,5,우리 아이에게 요것만 맞네요제일 순한듯요 굿입니다우리 아이에게 요것만 맞네요제일 순한듯요 굿입니다
678,5,사계절 내내 잘 쓰고 있어요 판매처마다 한개 9000원 하는곳도 있고 가격이 너무 다른데 저렴하게 샀어요 눈에 자극도 없고 막 발라도 잘 스며들고 화장전 사용하면 베이슬로도 손색이사계절 내내 잘 쓰고 있어요 판매처마다 한개 9000원 하는곳도 있고 가격이 너무 다른데 저렴하게 샀어요 눈에 자극도 없고 막 발라도 잘 스며들고 화장전 사용하면 베이슬로도 손색이 없어요 늘 챙겨놓는제품입니다 잘쓸께요
679,4,순한 것 같아요부드럽게 발리고 백탁현상 없어요 썬크림 특유위 향이 덜하고 복숭아향이 좋네요
680,5,좋아요전 피부 안좋아서 아무거나 바르면 트러블이 생기는데이건 안그러니까 넘 좋아요
681,5,조아요저렴해요 바이파세요 조으네요 조아이ㅡ
682,5,잘받았습니다아기외출할때바르면좋을거같아요
683,5,좋다해서 샀어요여름용으로요좋다해서 샀어요여름용으로요
684,5,선썬크림 바르고 자외선 보호해요
685,5,굳굳 계속해서 사용중입니다굳굳 계속해서 사용중입니다
686,4,향이 좋고 발림성도 좋아여향이 좋고 발림성도 좋아여
687,5,좋아요배송 빠르고 향도 괜찮아요 클렌징 티슈까지 같이 보내주셔서 감사합니다
688,5,배송 정말 빠르네요아직 사용전이지만 믿고 주문했습니다배송 정말 빠르네요아직 사용전이지만 믿고 주문했습니다
689,5,사용하고 좋아서 재구매하려고 매장 방문했더니 없어져서 이번엔 인터넷으로 구입하였습니다 오래오래 파세요ㅠㅠ 또올꺼예요!사용하고 좋아서 재구매하려고 매장 방문했더니 없어져서 이번엔 인터넷으로 구입하였습니다 오래오래 파세요ㅠㅠ 또올꺼예요!
690,5,5년 이상 꾸준히 사용하고 있는 썬크림입니다처음엔 아이를 위해 사용하기 시작했다가 이젠 아이와 제가 함께 사용하고 있어요향도 좋고 순해서 앞으로 단종되지 않는한 그린핑거 제품을5년 이상 꾸준히 사용하고 있는 썬크림입니다처음엔 아이를 위해 사용하기 시작했다가 이젠 아이와 제가 함께 사용하고 있어요향도 좋고 순해서 앞으로 단종되지 않는한 그린핑거 제품을 계속 사용할 것 같아요
691,5,잘쓰고있습니다 감사합니다잘쓰고있습니다 감사합니다
692,5,좋아요미리 준비했어요 이상없이 빠르게 잘받았습니다!!! 사은품도 좋아요
693,5,좋아요이번 여름동안 쓰게 넉넉히 샀네요 클렌징 티슈도 있고 더 좋아요 ㅋ
694,5,첫썬크림으로 그린핑거 썻어요발림이 밀리거나 백탁아니에요첫썬크림으로 그린핑거 썻어요발림이 밀리거나 백탁아니에요
695,4,잘 받았어요 유통기한이 생각보다 길진 않은데 할 수 없지요잘 받았어요 유통기한이 생각보다 길진 않은데 할 수 없지요
696,5,부드럽고촉촉하게 피부에 잘 스며들어 만족합니다
697,4,잘쓸게요여름철 아이 피부보호를 위해 구매해요
698,5,좋아요믿고쓰는제품올여름잘쓸게요
699,5,저렴하게 잘 샀어요행사할때 잘 구매했어요
700,5,그린핑거 썬크림 좋아요그린핑거 썬크림 좋아요
701,3,아기용이라 순해서 구매아기용이라 순해서 구매
702,5,부드럽게 잘 발려요부드럽게 잘 발려요
703,5,끈적이지 않고 좋네요쿠션으로만 쓰다가 너무 헤퍼서 크림으로 샀어요 좋네요 양도 많고 ㅋ
704,5,매일 쓰고 있어요매일 쓰고 있어요
705,4,잘 받았습니다 잘 받았습니다잘 받았습니다 잘 받았습니다
706,5,평이 좋아서 사봤어요 아이한테 잘 맞았으면 좋겠어요평이 좋아서 사봤어요 아이한테 잘 맞았으면 좋겠어요
707,5,재구매 백탁이나 밀림 없어요초등학생 딸이 타제품 쓰면서 얼굴이 울긋불긋해져서  이걸로 쓴 이후론 아무 이상 없어요 저도 쓰구요
708,5,시즌이 아닌지 대형마트에는  없더라구요  딱 필요했는데 정말 잘  쓸께요좋아요시즌이 아닌지 대형마트에는  없더라구요  딱 필요했는데 정말 잘  쓸께요좋아요
709,5,어른 아이모두 함께 바르려고 구입했어요하얀색 크림입니다
710,5,순해서 일년 내내 발라요끈적한 정도도 맘에 들어요순해서 일년 내내 발라요끈적한 정도도 맘에 들어요
711,5,선크림 이제 발라야겠어요날이 점점 뜨거워져서 산책할때  발라줘야겠어요
712,4,좋아요매년 우리 아이들 선크림은 요걸로 써요
713,4,항상 사용하는 제품이어서 잘 쓸게요항상 사용하는 제품이어서 잘 쓸게요
714,5,구매후기가격 저렴하고 배송 겁나 빠르고 유통기한까지 좋음ㅋ2021년 11월 7일까지
715,5,배송도 빠르고 아이도 좋아하네요배송도 빠르고 아이도 좋아하네요
716,5,아이들 바르기 순하고 좋아요아이들 바르기 순하고 좋아요
717,5,항상 쓰던거라 믿고 사용해요항상 쓰던거라 믿고 사용해요
718,5,조아요잘 받았습니다 잘 사용할께요
719,5,연하고 밀착감이ㅣ 좋아요연하고 밀착감이ㅣ 좋아요
720,5,선티슈까지줘서한번에 해결이네요 좋아요
721,5,잘쓰고 있어요 좋아요잘쓰고 있어요 좋아요
722,5,항상 사용하는 제품입니다특히 가격이 만족스럽습니다항상 사용하는 제품입니다특히 가격이 만족스럽습니다
723,5,친구의 추천으로 아이들 바르려고 구입했어요저렴하고 빠른 배송 굿입니다친구의 추천으로 아이들 바르려고 구입했어요저렴하고 빠른 배송 굿입니다
724,5,잘 받았어요우리 아이 늘 사용하는 썬크림이에요 잘 쓰겠습니다
725,4,매번 쓰던 썬크림 아이들한테 자극없고 좋아요!매번 쓰던 썬크림 아이들한테 자극없고 좋아요!
726,5,발림성 좋고 냄새도 좋아요 잘쓰겠습니다발림성 좋고 냄새도 좋아요 잘쓰겠습니다
727,5,썬크림 좋네요 끈적임 없구요보습도 좋아요 향도 좋구요
728,5,배송 빠르고 만족합니다배송 빠르고 만족합니다
729,5,잘쓰고있어요m  잘쓰고있어요m  
730,4,발림성 좋고 부드러워요순해서 잘 사용하고 있어요 항상 애용합니다 ㅎㅎ발림성 좋고 부드러워요순해서 잘 사용하고 있어요 항상 애용합니다 ㅎㅎ
731,5,배송빠르고 좋아요트러블없어서 항상 쓰는 제품이에요 배송빨라요 유통기한 참고하세요
732,5,매번 사용하는 제품이라 잘 쓸께요 빠른배송도 감사해요매번 사용하는 제품이라 잘 쓸께요 빠른배송도 감사해요
733,5,늘 쓰던 썬크림인데 저렴하게 사서 좋아요ㅎㅎ늘 쓰던 썬크림인데 저렴하게 사서 좋아요ㅎㅎ
734,5,좋아요좋아요 굿입니다 좋아요
735,5,찐득하지않아서좋아요   발림성도좋고찐득하지않아서좋아요   발림성도좋고
736,4,좋다고 소문만 들었는데 처음 써봐요좋다고 소문만 들었는데 처음 써봐요
737,5,부드럽게 잘 발리고 좋아요부드럽게 잘 발리고 좋아요
738,5,잘발리고 안끈적해서 좋아요잘발리고 안끈적해서 좋아요
739,5,저렴하게 잘 구입했어요저렴하게 잘 구입했어요
740,5,항상 쓰는 제품 잘 샀습니다항상 쓰는 제품 잘 샀습니다
741,5,순해요굉장히 순하고 좋습니다!!
742,5,가격대비 만족입니다가격대비 만족입니다
743,5,좋아요어직 애들한테발라주진않고 손등에 발라봤는게 괜찮은것 같아요
744,5,잘 받았습니다세일해서 잘 샀어요
745,5,늘 이거만 씁니다 아이들과 저도 같이 바릅니다 넘 좋아요ㅎ좋은가격에 사서 만족합니다늘 이거만 씁니다 아이들과 저도 같이 바릅니다 넘 좋아요ㅎ좋은가격에 사서 만족합니다
746,5,썬크림은 그린핑거만 써요 다른제품 사줬는데 아이가 그썬크림은 그린핑거만 써요다른제품 사줬는데 아이가 그린핑거가 훨씬 좋다네요그래서 또 샀습니다
747,5,최고예요아이들 썬크림으로 샀는데 저도 함께 바르고있어요바르면 안색이 톤업되네요ㅋ피부가 민감한데 트러블없이 이용하고 있어요향은 강한 편이지만 싫어하지 않는 향이라 좋아요
748,5,유통기한 22년 8월입니다 초딩아이들과 같이 쓰고 있어유통기한 22년 8월입니다초딩아이들과 같이 쓰고 있어요순하고 향도 많이 안나고 좋아요저렴하게 잘 구매한것같아 만족합니다
749,5,늘 사용해요 애기만 쓰다가 엄마도 함께 사용늘 사용해요 애기만 쓰다가 엄마도 함께 사용
750,5,빠른 배송 저렴한 가격  이 보다 좋은 수는 없는 제품빠른 배송 저렴한 가격  이 보다 좋은 수는 없는 제품아기 때부터 중학생인 딸이  지금까지 쓰는 제품이에요
751,5,늘 쓰던제품아이들 썬크림은 항상 이걸 써요축구 하는 아들래미둘 한테 딱이에요
752,5,눈따가움이 적어 구매했어요 배송도빠르고 좋아요눈따가움이 적어 구매했어요 배송도빠르고 좋아요
753,5,최고예요아이가 쓰려고 샀는데 피부가 뒤집어져 할수없이 제가 쓰는데 좋아서 계속 이것만 써요
754,5,몇년째 쓰고 있어요  아이들과 쓰기 좋습니다몇년째 쓰고 있어요  아이들과 쓰기 좋습니다
755,3,캠핑가서 발랐는데 잘 발라지고 좋네요캠핑가서 발랐는데 잘 발라지고 좋네요
756,5,잘 도착했어요원래 사용하던 제품아이가 편하대요
757,5,그린핑거 좋아요아이들이 향을 좋아하네요 만족해요
758,5,발림성 최고예요 ㅠㅠ향도 좋아요에발림성 최고예요 ㅠㅠ향도 좋아요에
759,5,여름 나기 위해 4개 주문했어요여름 나기 위해 4개 주문했어요
760,5,매우 만족해서 재구매했어요매우 만족해서 재구매했어요
761,5,늘 사용하는거 저렴히 구입늘 사용하는거 저렴히 구입
762,4,저렴하게 구입해서 좋아요저렴하게 구입해서 좋아요
763,5,잘쓰고있어요감사합니다잘쓰고있어요감사합니다
764,5,여름되면  늘쓰는  재품여름되면  늘쓰는  재품
765,5,베송도 빠르고 좋아요베송도 빠르고 좋아요
766,5,잘쓰겠습니다감사합니다잘쓸께요
767,4,잘 받았습니다 ㅎㅎ잘 받았습니다 ㅎㅎ
768,5,이건늘써요아이들향도좋고순해요하나누락되와서당황했는데친절히바로보내주셔서감사합니다이건늘써요아이들향도좋고순해요하나누락되와서당황했는데친절히바로보내주셔서감사합니다
769,4,늘 쓰는 제품이예요  발랐을때 얼굴이 뽀얗게 보이긴하늘 쓰는 제품이예요  발랐을때 얼굴이 뽀얗게 보이긴하지만 발림성도 좋고 향도 괜찮아요
770,5,잘 쓸게요늘 쓰던 거 다시 구매 했어요 배송 빨랐어요
771,5,배송 빨라요 적당히 촉촉하고 유분기도 살짝 잡아주고 완전 만족하고 가격도 착하고 좋네용ㅎㅎ배송 빨라요 적당히 촉촉하고 유분기도 살짝 잡아주고 완전 만족하고 가격도 착하고 좋네용ㅎㅎ
772,5,아기 발라 주려고 샀는데 제가 더 많이 쓰네요  매번 주문 합니다 순해요아기 발라 주려고 샀는데 제가 더 많이 쓰네요  매번 주문 합니다 순해요
773,5,향도 좋고 더운날 끈적이지 않네요 아이가 직접 눌러 바를수있어요향도 좋고 더운날 끈적이지 않네요 아이가 직접 눌러 바를수있어요
774,5,좋아요백탁현상 없이 잘 발리고 향도 좋네요클렌징티슈사은품도 좋아요
775,5,배송빨라요 아직 사용전이지만 아이한테 잘 맞았으면 좋겠어요배송빨라요 아직 사용전이지만 아이한테 잘 맞았으면 좋겠어요
776,5,아주아주마음에들어요아주아주마음에들어요
777,5,좋아효 이것만 바르고 나가도 화장했냐고 물어보고 피부좋아보인다고 많이 들었어요좋아효 이것만 바르고 나가도 화장했냐고 물어보고 피부좋아보인다고 많이 들었어요
778,5,좋아요 아이들 피부 타지않게 매일 발라주고 있습니다좋아요 아이들 피부 타지않게 매일 발라주고 있습니다
779,5,여름되면 한번씩 쓰는거라 만족하면서 사용중이빈다여름되면 한번씩 쓰는거라 만족하면서 사용중이빈다
780,4,저렴한가격에 어른 아이 같이사용하려고 주문했어요저렴한가격에 어른 아이 같이사용하려고 주문했어요
781,5,좋아요중복쿠폰으로 저렴하게 구입 사은품까지 좋아요
782,4,작년에쓰고  재구매아이 어른 같이 쓰기좋아요사은품도 감사해요
783,5,끈적임도 없고 흡수도 잘되서 이제품만 쓰네요끈적임도 없고 흡수도 잘되서 이제품만 쓰네요
784,4,어른들이 써도 너무 좋아서 또 구매하였습니다어른들이 써도 너무 좋아서 또 구매하였습니다
785,3,배송이빠른편입니다어른이쓰기도괞찬아요배송이빠른편입니다어른이쓰기도괞찬아요
786,4,아직 써 보진 않았지만 상태는 괜찮아요아직 써 보진 않았지만 상태는 괜찮아요
787,5,잘받았습니다사용해보니 좋네요저렴하게 구입했어요
788,5,눈안따갑고 좋으네요 발림성도 좋구요눈안따갑고 좋으네요 발림성도 좋구요
789,4,배송빠르고 저렴하고 좋네용ㅎ배송빠르고 저렴하고 좋네용ㅎ
790,5,많이 끈적거리지 않아 좋아요많이 끈적거리지 않아 좋아요
791,5,늘 쓰던거라 쓰켰어요 좋아요늘 쓰던거라 쓰켰어요 좋아요
792,5,순하고 냄새가 많이 안남순하고 냄새가 많이 안남
793,5,좋아요이것만 사용합니다
794,5,아이들과 함께 사용하는데 너무 좋아요백탁현상 없이 산뜻하게 마무리 되어 매번 이것만 사용하게 되네요아이들과 함께 사용하는데 너무 좋아요백탁현상 없이 산뜻하게 마무리 되어 매번 이것만 사용하게 되네요
795,5,잘 샀어요야외놀이 자주 하는 요즘 저렴하게 구매해서 잘 쓰고 있어요 잘 안지워져서 같이 보내 준 클렌징티슈 필수네요
796,4,선크림 선크림 2개랑 티슈 들어 있어서 유용하게 사용 할 듯요피부가 민감한 딸 아이 이 제품 사용하니까 좋다고 하네요 배송도 빠르고 상품도 만족합니다
797,5,순하고 향도 좋고다른 제품은 애들이 쓰면 뭐 나고 그랬는데 이건 괜찮아요 이것만 써요
798,4,좋아요생각보다는 끈적이지 않아요 선로션이 넘 약한가 싶어서 구매했어요
799,5,항상 애기가 10년째 이거 써여 믿고 쓰니까 잘 만들어주세요항상 애기가 10년째 이거 써여 믿고 쓰니까 잘 만들어주세요
800,5,아직 써보진않앗지만 배송도빠르고 저렴하게 구입잘햇네요아직 써보진않앗지만 배송도빠르고 저렴하게 구입잘햇네요
801,4,잘 발려요 자외선 차단 효과도 기대해봅니다잘 발려요 자외선 차단 효과도 기대해봅니다
802,5,썬크림늘 쓰던 썬크림입니다올해도 잘써볼께요
803,5,부드럽고 좋아요 잘 쓸께요 감사합니다부드럽고 좋아요 잘 쓸께요 감사합니다
804,5,향도 좋고 끈적임 없어 이거로 쓰네요향도 좋고 끈적임 없어 이거로 쓰네요
805,4,순해서  좋아요 거의 다 써가네요순해서  좋아요 거의 다 써가네요
806,5,썬크림 잘사용하고있어요항상 쓰던건라 믿고 쓰고 있어요
807,5,빠른배송 좋은 가격 굿입니다빠른배송 좋은 가격 굿입니다
808,4,너무 기름지지 않고 좋아요너무 기름지지 않고 좋아요
809,5,좋아요저렴하게 구매해서 좋아요
810,5,가격저렴하고 향도 좋아요가격저렴하고 향도 좋아요
811,4,항상쓰는 제품입니다항상쓰는 제품입니다
812,5,만족해요가격대비 만족해요
813,5,배송이 빠릅니다배송이 빠릅니다
814,5,그린핑거 크림 쓰고있어서 선크림도 구매해봤어요 배송은 조금 느렸어요ㅠ그린핑거 크림 쓰고있어서 선크림도 구매해봤어요 배송은 조금 느렸어요ㅠ
815,4,처음 구매해봅니다기존에 아이 쓰던게 있는데 그린핑거 가격이 저렴하기도해서 처음 구매해봅니다 아이 피부에 잘 맞았으면 좋겠네요
816,5,만족합니다 배송도빠르고 감사합니다만족합니다 배송도빠르고 감사합니다
817,5,끈적임이 없어서 좋아요저희 가족은 다 그린핑거만 사용합니다끈적임이 없어서 좋아요저희 가족은 다 그린핑거만 사용합니다
818,5,상품의 질이 매우뛰어납니다 매상품의 질이 매우뛰어납니다 매우 만족하고 있으며 추후에 반드시또 구매하겠습니다양질의 상품을 배송해주셔서 감사합니다또 주문할께요상품의 질이 매우뛰어납니다 매우 만족하고 있으며 추후에 반드시또 구매하겠습니다양질의 상품을 배송해주셔서 감사합니다또 주문할께요
819,5,빠른배송에 저렴한 가격으로 구매해서 좋아요빠른배송에 저렴한 가격으로 구매해서 좋아요
820,5,잘받았어요!순해서 좋던데 잘 사용할게요ㅎㅎ잘받았어요!순해서 좋던데 잘 사용할게요ㅎㅎ2개의 포토리뷰2개의 포토리뷰
821,5,최고예요늘 애용중인 제품입니다 마음에 들어요
822,5,재구매했어요 잘 사용중에 있습니다재구매했어요 잘 사용중에 있습니다
823,4,배송도 빠르고 마음에 들어요배송도 빠르고 마음에 들어요
824,5,아리을한테 좋을고 같아요아리을한테 좋을고 같아요
825,5,배송 빠르고 상품 좋아요배송 빠르고 상품 좋아요
826,5,좋아요어른도 같이 써요어어
827,5,좋아요ㅡ잘받았어요ㅡ여름대비 선크림장만했네요아직안썼는데 괜찮을것같네요ㅡ
828,5,순하구 좋대요남편이 매일 발라요어른 썬크림은 얼굴이 뒤집어 지고 해서 항상 구매하는 제품입니다사은품 클렌징티슈 감사합니다
829,5,발림성도 좋고 백탁현상 없이 깔끔하게 흡수되어 매번 이것만 쓰고 있습니다중학생 딸도 예민한 피부인데 이 제품은 자극없이 순하다며 애용하고 있네요발림성도 좋고 백탁현상 없이 깔끔하게 흡수되어 매번 이것만 쓰고 있습니다중학생 딸도 예민한 피부인데 이 제품은 자극없이 순하다며 애용하고 있네요
830,4,좋아요아이라 썬크림쓰고 클렌징할때 힘들었는데 클렌징티슈까지 와서 좋아요
831,5,썬크림 2개 사은품 굿아가들거라그런지 귀여워요  사은품 센스돋습니당좋아요 꾹꾹 입니다
832,5,배송 빨리 해주셔서 감사합니다배송 빨리 해주셔서 감사합니다물티슈도 유용하게 쓰네요
833,5,언제나 그렇듯  그린핑거만6년째 그린핑거 제품들만 사용하고잇는 삼남매들은 그린핑거만 좋아해요
834,5,추천을 많이하는 선크림이라 구매했어요 전 아직 써보진 추천을 많이하는 선크림이라 구매했어요전 아직 써보진 않았지만 부디괜찮기를 바라요
835,5,늘 쓰는 선크림입니다발림성좋고 순하고 백탁현상 예쁘게 있고 가격이 싸요늘 쓰는 선크림입니다발림성좋고 순하고 백탁현상 예쁘게 있고 가격이 싸요
836,5,배송빠르고 좋아요ㅎㅎ배송빠르고 좋아요ㅎㅎ
837,5,좋아요배송 빠르고 저렴합니다아직 사용 전이나 전에 써보니 괜찮두라구요
838,5,좋아요!늘 쓰던건데 저렴히 잘 샀어요 유통기한도 내년까지네요
839,5,믿고 사는  그린핑거에요몇통째 쓰고 있어요믿고 사는  그린핑거에요몇통째 쓰고 있어요
840,5,마음에 들어요햠도 좋고 부드럽게 발려서 좋아요감사해요
841,5,좋아요아이들 쓰려고 샀어요배송 빠르고 좋아요
842,5,늘쓰는 제품입니다순해서 좋아요늘쓰는 제품입니다순해서 좋아요
843,4,아직 사용전이긴 하지만 믿어요아직 사용전이긴 하지만 믿어요
844,5,곧 여름이 다가와서 미리 준비했네요11할때 저렴히 사서 좋아요
845,5,ㅎ아지 안써봤는데 좋겠죠?ㅎㅎ
846,5,늘 쓰는제품이예요 좋아요늘 쓰는제품이예요 좋아요
847,5,여름마다  쓰는제품이예요여름마다  쓰는제품이예요
848,5,올여름 잘 쓸 것 같아요!올여름 잘 쓸 것 같아요!
849,4,잘받았습니다아직 사용전이지만  가족 모두 함께 사용하기 좋을듯 하네요  잘쓸께요
850,5,썬크림야외놀이 썬크림 매번 요것만 사용합니다아들 6학년인데 아직까지는 좋네요잘받았습니다 잘받았습니다 잘받았습니다
851,4,좋아요향도 괜찮고 끈적끈적한 느낌도 없어서 바르기 좋아요
852,5,옥션이 제일 저렴해서 구매했습니다 예전에 사용했었던 제옥션이 제일 저렴해서 구매했습니다 예전에 사용했었던 제품이라 다시 써보려고 구매했는데 만족합니다 ! 11이어서 하나는 제가 쓰고 하나는 엄마 드렸네요ㅎㅎ
853,5,좋아요올여름 잘쓸게요 사홋귿솧늣ㅇㄱㄷㅅㄴㅅㅇㄴㄷ
854,5,여름되면 늘 구매아빠 엄마 누나 동생 모두 함께 사용해요발림도 좋고 톤업되는 기분도 둘고여름되면 늘 구매아빠 엄마 누나 동생 모두 함께 사용해요발림도 좋고 톤업되는 기분도 둘고
855,5,이제품 출시부터 써오고 있어요그린핑거가 우리 첫째가 아기였을때 런칭 되었는데 야외놀이 썬로션 나올때부터 첫째 중딩된 지금까지 쓰고 있어요순하고 차단력도 있는거 같아요 향도 좋구요 사은품도 감사합니다
856,5,배송빠르고 포장 꼼꼼히잘해주셧어요늘쓰는제품이라 저렴하게 잘구입했어요 유동기한 넉넉한제품 잘쓸게요배송빠르고 포장 꼼꼼히잘해주셧어요늘쓰는제품이라 저렴하게 잘구입했어요 유동기한 넉넉한제품 잘쓸게요
857,5,우리 아이에게 요것만 맞네요제일 순한듯요 굿입니다우리 아이에게 요것만 맞네요제일 순한듯요 굿입니다
858,5,사계절 내내 잘 쓰고 있어요 판매처마다 한개 9000원 하는곳도 있고 가격이 너무 다른데 저렴하게 샀어요 눈에 자극도 없고 막 발라도 잘 스며들고 화장전 사용하면 베이슬로도 손색이사계절 내내 잘 쓰고 있어요 판매처마다 한개 9000원 하는곳도 있고 가격이 너무 다른데 저렴하게 샀어요 눈에 자극도 없고 막 발라도 잘 스며들고 화장전 사용하면 베이슬로도 손색이 없어요 늘 챙겨놓는제품입니다 잘쓸께요
859,4,순한 것 같아요부드럽게 발리고 백탁현상 없어요 썬크림 특유위 향이 덜하고 복숭아향이 좋네요
860,5,좋아요전 피부 안좋아서 아무거나 바르면 트러블이 생기는데이건 안그러니까 넘 좋아요
861,5,조아요저렴해요 바이파세요 조으네요 조아이ㅡ
862,5,잘받았습니다아기외출할때바르면좋을거같아요
863,5,좋다해서 샀어요여름용으로요좋다해서 샀어요여름용으로요
864,5,선썬크림 바르고 자외선 보호해요
865,5,굳굳 계속해서 사용중입니다굳굳 계속해서 사용중입니다
866,4,향이 좋고 발림성도 좋아여향이 좋고 발림성도 좋아여
867,5,좋아요배송 빠르고 향도 괜찮아요 클렌징 티슈까지 같이 보내주셔서 감사합니다
