,평점,본문
0,5,항상 쓰는 썬크림이에요 이제 곧 여름이 될텐데 더 듬뿍듬뿍 써야겠어용 튜브령이라 그런지 써도써도 공기 빵빵하게 흔들면 계속 나오고 유통기한도 길어서 잘 쓸 수 있어요 백탁도 적당항상 쓰는 썬크림이에요 이제 곧 여름이 될텐데 더 듬뿍듬뿍 써야겠어용 튜브령이라 그런지 써도써도 공기 빵빵하게 흔들면 계속 나오고 유통기한도 길어서 잘 쓸 수 있어요 백탁도 적당하고 너무 건조하지도 유분기 있지도 않고 딱이에요 다 쓰면 또 살거에요 그린핑거 야외놀이 썬크림 짱짱
1,5,가격도 저렴하고 배송비때문에 항상 3개씩은 사는데 유통기한 넉넉해서 좋아요! 이 선크림 20대 중반인 제 최애입니다 적당히 하얘지고 자외선 차단 효과도 좋은거같아요 기름지지 가격도 저렴하고 배송비때문에 항상 3개씩은 사는데 유통기한 넉넉해서 좋아요! 이 선크림 20대 중반인 제 최애입니다 적당히 하얘지고 자외선 차단 효과도 좋은거같아요 기름지지 않고 부드럽게 발리고ㅠㅠ 걍 최고에요ㅠㅠ 절대 단종 안됐음 좋겠어요 단종절대반대ㅠ 다들 많이 사세요
2,5,매우 만족합니다많이 파세요매우 만족합니다많이 파세요매우 만족합니다많이 파세요매우 만족합니다많이 파세요매우 만족합니다많이 파세요매우 만족합니다많이 파세요매우 만매우 만족합니다많이 파세요매우 만족합니다많이 파세요매우 만족합니다많이 파세요매우 만족합니다많이 파세요매우 만족합니다많이 파세요매우 만족합니다많이 파세요매우 만족합니다많이 파세요매우 만족합니다많이 파세요매우 만족합니다많이 파세요매우 만족합니다많이 파세요매우 만족합니다많이 파세요매우 만족합니다많이 파세요매우 만족합니다많이 파세요매우 만족합니다많이 파세요매우 만족합니다많이 파세요매우 만족합니다많이 파세요매우 만족합니다많이 파세요매우 만족합니다많이 파세요매우 만족합니다많이 파세요매우 만족합니다많이 파세요매우 만족합니다많이 파세요매우 만족합니다많이 파세요매우 만족합니다많이 파세요매우 만족합니다많이 파세요매우 만족합니다많이 파세요매우 만족합니다많이 파세요매우 만족합니다많이 파세요매우 만족합니다많이 파세요매우 만족합니다많이 파세요매우 만족합니다많이 파세요매우 만족합니다많이 파세요매우 만족합니다많이 파세요매우 만족합니다많이 파세요매우 만족합니다많이 파세요매우 만족합니다많이 파세요매우 만족합니다많이 파세요매우 만족합니다많이 파세요매우 만족합니다많이 파세요매우 만족합니다많이 파세요매우 만족합니다많이 파세요매우 만족합니다많이 파세요매우 만족합니다많이 파세요매우 만족합니다많이 파세요매우 만족합니다많이 파세요매우 만족합니다많이 파세요매우 만족합니다많이 파세요매우 만족합니다많이 파세요매우 만족합니다많이 파세요매우 만족합니다많이 파세요매우 만족합니다많이 파세요매우 만족합니다많이 파세요매우 만족합니다많이 파세요매우 만족합니다많이 파세요매우 만족합니다많이 파세요매우 만족합니다많이 파세요매우 만족합니다많이 파세요매우 만족합니다많이 파세요매우 만족합니다많이 파세요매우 만족합니다많이 파세요매우 만족합니다많이 파세요매우 만족합니다많이 파세요매우 만족합니다많이 파세요매우 만족합니다많이 파세요매우 만족합니다많이 파세요매우 만족합니다많이 파세요매우 만족합니다많이 파세요매우 만족합니다많이 파세요매우 만족합니다많이 파세요매우 만족합니다많이 파세요매우 만족합니다많이 파세요매우 만족합니다많이 파세요매우 만족합니다많이 파세요매우 만족합니다많이 파세요매우 만족합니다많이 파세요매우 만족합니다많이 파세요매우 만족합니다많이 파세요매우 만족합니다많이 파세요매우 만족합니다많이 파세요매우 만족합니다많이 파세요매우 만족합니다많이 파세요매우 만족합니다많이 파세요매우 만족합니다많이 파세요매우 만족합니다많이 파세요매우 만족합니다많이 파세요매우 만족합니다많이 파세요매우 만족합니다많이 파세요매우 만족합니다많이 파세요매우 만족합니다많이 파세요매우 만족합니다많이 파세요매우 만족합니다많이 파세요매우 만족합니다많이 파세요매우 만족합니다많이 파세요매우 만족합니다많이 파세요매우 만족합니다많이 파세요매우 만족합니다많이 파세요매우 만족합니다많이 파세요매우 만족합니다많이 파세요매우 만족합니다많이 파세요매우 만족합니다많이 파세요매우 만족합니다많이 파세요매우 만족합니다많이 파세요매우 만족합니다많이 파세요매우 만족합니다많이 파세요매우 만족합니다많이 파세요매우 만족합니다많이 파세요매우 만족합니다많이 파세요매우 만족합니다많이 파세요매우 만족합니다많이 파세요매우 만족합니다많이 파세요매우 만족합니다많이 파세요매우 만족합니다많이 파세요매우 만족합니다많이 파세요매우 만족합니다많이 파세요매우 만족합니다많이 파세요매우 만족합니다많이 파세요매우 만족합니다많이 파세요매우 만족합니다많이 파세요매우 만족합니다많이 파세요매우 만족합니다많이 파세요매우 만족합니다많이 파세요매우 만족합니다많이 파세요매우 만족합니다많이 파세요매우 만족합니다많이 파세요매우 만족합니다많이 파세요매우 만족합니다많이 파세요매우 만족합니다많이 파세요매우 만족합니다많이 파세요매우 만족합니다많이 파세요매우 만족합니다많이 파세요매우 만족합니다많이 파세요매우 만족합니다많이 파세요매우 만족합니다많이 파세요매우 만족합니다많이 파세요매우 만족합니다많이 파세요매우 만족합니다많이 파세요매우 만족합니다많이 파세요매우 만족합니다많이 파세요매우 만족합니다많이 파세요매우 만족합니다많이 파세요매우 만족합니다많이 파세요매우 만족합니다많이 파세요매우 만족합니다많이 파세요매우 만족합니다많이 파세요매우 만족합니다많이 파세요매우 만족합니다많이 파세요매우 만족합니다많이 파세요매우 만족합니다많이 파세요매우 만족합니다많이 파세요매우 만족합니다많이 파세요매우 만족합니다많이 파세요매우 만족합니다많이 파세요매우 만족합니다많이 파세요매우 만족합니다많이 파세요매우 만족합니다많이 파세요매우 만족합니다많이 파세요
3,4,만족배송은 월요일날 시켜서 화요일날 받았어요 선크림에 비해 큰 박스 안에 덩그러니 있었어요 깨지거나 그런 상품은 아니니 신경은 안써요 오자마자 손등에 발라봤는데 성분에 향료가 있어서 그런지 향은 좋은데 너무 강한듯싶어요 발림성은 좋은거같고 촉촉하게 발려요 유분이 있긴 있는데 금방 피부에 흡수되며 사그라들어요 아직 바르고 밖에 나가진 않아서 자외선차단능력은 아직 모르겠어요 그린핑거 선크림 처음 구매해보는데 나쁘지 않네요 만족해요
4,5,늘 사용하는 제품이에요 사은품은 안 왔네요순하고 살짝 색보정 효과도 있어서 저도 아이들과 함께 쓰는 제품이에요 다른 썬크림들 많이 써 봤지만 이 제품이 가장 맘에 들어요마침 11 행사도 해서 저렴하게 구입했어요그런데 사은품으로 준다던 비치볼은 실수로 누락된 건지 다 품절된 건지 아쉽게도 못 받았네요 
5,4,오래 쓰고 있는 선크림이에요 백탁이 좀 있는 편이라고 생각했는데 다른 거 쓰던 친구는 이정도는 백탁 심한거 아니라고 하더라구요 향이나 백탁 때문에 한 번 써보고 사는 게 좋을 오래 쓰고 있는 선크림이에요 백탁이 좀 있는 편이라고 생각했는데 다른 거 쓰던 친구는 이정도는 백탁 심한거 아니라고 하더라구요 향이나 백탁 때문에 한 번 써보고 사는 게 좋을 것 같아요 저는 만족해서 계속 쓰고 있습니다
6,5,성인이지만 선크림에 대해서는 조금 예민하고 백탁현상도 싫어서 로드샵이나 백화점 선크림은 잘 안씁니다 우연히 동생 선크림 뺏어 바르고나서 정착했고 요번에 다떨어져서 요기서 구매했성인이지만 선크림에 대해서는 조금 예민하고 백탁현상도 싫어서 로드샵이나 백화점 선크림은 잘 안씁니다 우연히 동생 선크림 뺏어 바르고나서 정착했고 요번에 다떨어져서 요기서 구매했는데 정말 순하고 좋아요 ㅠㅠ 담번에도 여기서 구매할게요 !!
7,5,뜨거운 햇볕에도 피부를 잘 보호해줘요 평소에는 썬크림 잘 안발라요 여름에 뜨거운 햇볕에 3박 4일 여행가서 발랐는데 하나도 안탔어요 끈적임이나 자극없이 아이 어른 모두 사용하뜨거운 햇볕에도 피부를 잘 보호해줘요 평소에는 썬크림 잘 안발라요 여름에 뜨거운 햇볕에 3박 4일 여행가서 발랐는데 하나도 안탔어요 끈적임이나 자극없이 아이 어른 모두 사용하기 괜찮아요 다만 씻을 때는 꼼꼼하게 잘 씻어내야 되요
8,5,조아요 애들도  그렇고   저도  그렇고   피부가  예민해서   왠만하면  해가   있는곳에서 오래  잘  놀지도 않고  그런상황이   오면   썬크림을   꼭   발라야하조아요 애들도  그렇고   저도  그렇고   피부가  예민해서   왠만하면  해가   있는곳에서 오래  잘  놀지도 않고  그런상황이   오면   썬크림을   꼭   발라야하는데   그마저도  피부가  여의치않아  아무거나  바르면   피부트러블이   생겨   아무거나  바르지못해요   그런데  요건  장시간  이몽해도  특별히  문제가 없어서   온 식구가  사용을합니다
9,3,어이없는 견본품 본품 사용기한은 1년이상남은 제품으로 왔는데사은품으로 보내준 견본품은 사용기한이 2008년8월이네요 무려 10년전에 폐기했어야할 제품을너무어이가 없어서 프리미어이없는 견본품 본품 사용기한은 1년이상남은 제품으로 왔는데사은품으로 보내준 견본품은 사용기한이 2008년8월이네요 무려 10년전에 폐기했어야할 제품을너무어이가 없어서 프리미엄까지 남기고갑니다본품에 이상이 없는관계로 일단 구매확정합니다사은품보내실땐 최소한 사용기한 정도는 확인하고 보내시기바랍니다2개의 포토리뷰2개의 포토리뷰
10,5,늘 쓰는 제품입니다 다른 선크림은 유분기가 심하거나 뜨거나 둘중 하나인데 이 제품은 안 그래서 좋아요단 백탁 있는데 처음에만 좀 하얗지 나중에는 cc크림 느낌으로 자연스럽게 하늘 쓰는 제품입니다 다른 선크림은 유분기가 심하거나 뜨거나 둘중 하나인데 이 제품은 안 그래서 좋아요단 백탁 있는데 처음에만 좀 하얗지 나중에는 cc크림 느낌으로 자연스럽게 하얘집니다키즈 제품이긴 한데 혹시 피부 예민하신 성인 분들 있으시면 한번 써보세요 좋습니다
11,4,배송 신경써주세요깨지지않는거지만 포장에 신경쓰셨으면좋겠어요 배송온 상태가 엉망이라 생상품 받는다는생각이 안드네요2세트주문이면 컵도 2세트와야하는거아닌지요? 한세트밖에 오지않았습니다 별 필요없는거라 괜찮지만 사은품도 꼼꼼히신경써서 보내셔야할꺼같네요
12,5,아기한테백탁 향은 정말 좋은데스틱형으로샀는데 이거바르면가오나시손으로 문질러줘야하는데 그러면 이걸 산 이유가없죠 손에 안묻히려고 스틱형으로산건데자외선차단도 잘안되아기한테백탁 향은 정말 좋은데스틱형으로샀는데 이거바르면가오나시손으로 문질러줘야하는데 그러면 이걸 산 이유가없죠 손에 안묻히려고 스틱형으로산건데자외선차단도 잘안되여 바닷가 갔는데 볼옆이  올가 쓰다가 이거쓰려느
13,5,강력추천!! 에바비바 썬크림 쓰다 이고 썬세스로 갈아타고마트에서 테스트해보고 구매하게되엇어요!바르니 백탁현상 없이 로션바르듯이 문질문질하니 부드럽게 촥 밀착되더라구요방과후활동강력추천!! 에바비바 썬크림 쓰다 이고 썬세스로 갈아타고마트에서 테스트해보고 구매하게되엇어요!바르니 백탁현상 없이 로션바르듯이 문질문질하니 부드럽게 촥 밀착되더라구요방과후활동 축구교실갈때 바를려고 샀어요!가격도 저렴히 잘 구매한것같아 만족입니다
14,4,믿고 써요 그린핑거 라인을 거의 다 써봤어요 로션 보습은 아쉬워서 지금은 세정쪽만 쓰고 있는데 썬제품도 괜찮았던 기억이 나서 선택했어요 다른 브랜드에서 샀던 썬제품에는 아이 피부에믿고 써요 그린핑거 라인을 거의 다 써봤어요 로션 보습은 아쉬워서 지금은 세정쪽만 쓰고 있는데 썬제품도 괜찮았던 기억이 나서 선택했어요 다른 브랜드에서 샀던 썬제품에는 아이 피부에 뭔가 올라왔는데 그린핑거는 안그래서 성분이 잘 맞나보다 싶어요 구성도 좋네요
15,4,타임특가로 타임특가로마트파는것보단확실히싸게잘구매한건가?ㅎㅎ요즘워낙마트에서도11을많이하니사실가격이싼건잘모르겠고귀찮아서인터넷에서가격비교도사실안해봄여튼애들여름에써야해서구매했고상품구타임특가로 타임특가로마트파는것보단확실히싸게잘구매한건가?ㅎㅎ요즘워낙마트에서도11을많이하니사실가격이싼건잘모르겠고귀찮아서인터넷에서가격비교도사실안해봄여튼애들여름에써야해서구매했고상품구성은마음에듭니다
16,5,워셔블선크림 봄이라 햇살이 좀 쎄진것 같아서 애기 발라주려고 삿어요주말 야외놀이나 유치원갈때 로션바르듯 발라주고 물로도 가볍게 지워진다니 안심하고 쓰고있어요 이벤트로 스틱형까지워셔블선크림 봄이라 햇살이 좀 쎄진것 같아서 애기 발라주려고 삿어요주말 야외놀이나 유치원갈때 로션바르듯 발라주고 물로도 가볍게 지워진다니 안심하고 쓰고있어요 이벤트로 스틱형까지 같이 구매해서 바쁜 아침에는 스틱형으로 슥슥 그어발라서 보내고 주말야외놀이 가기전엔 워셔블선크림 듬뿍ㅈ발라 나가요ㅎㅎ아이용으로 나온거라 자극도 없고 순한것 같아요!
17,5,나이 상관 없이 누구에게나 잘 맞을 제품 이 제품 하나만 있어도 어린아이부터 어른까지 관계 없이 잘 쓸 수 있어서 참 좋은 것 같아요가격대비 양도 많아서 많이 써도 아깝지 않네요나이 상관 없이 누구에게나 잘 맞을 제품 이 제품 하나만 있어도 어린아이부터 어른까지 관계 없이 잘 쓸 수 있어서 참 좋은 것 같아요가격대비 양도 많아서 많이 써도 아깝지 않네요선크림을 살 때 가장 신경쓰이는 부분이 백탁 현상인데 이 제품은 백탁현상도 없네요 ㅎㅎ 잘 쓰겠습니다
18,4,배송은 빠른데 제가 정말 초초10000 예민피부인데요 이것도 트러블이 없진 않네요ㅜㅜ바를때 백탁현상 있길래 순하겠다 싶어 나름 기대했는데 글고 눈시림현상도 있긴해요 그래배송은 빠른데 제가 정말 초초10000 예민피부인데요 이것도 트러블이 없진 않네요ㅜㅜ바를때 백탁현상 있길래 순하겠다 싶어 나름 기대했는데 글고 눈시림현상도 있긴해요 그래도 지금까지 거쳐온 다른 제품들에 비해선 트러블이나 눈시림이 적긴해요 가격도 착하고요
19,4,배송은 보통  아직 사용전  순수하다는 평때문에 구매함  성인 항상 순수한 제품 사용하고 있어서 해당 제품 상품평 보고 구매하게 되었습니다아직 사용전이고 유아용이라 걱정은 배송은 보통  아직 사용전  순수하다는 평때문에 구매함  성인 항상 순수한 제품 사용하고 있어서 해당 제품 상품평 보고 구매하게 되었습니다아직 사용전이고 유아용이라 걱정은 딱히 없내요배송은 보통클랜저 미니로 보내준것도 사용해볼 예정입니다
20,4,더운 여름 잘 보내겠습니다 항상 쓰던 제품이고 2017년 새로 나왔다고 해서 여러개 주문했는데 이 상품은 박스 포장이 안되어 있네요새로 사는 분들은 참고 하셔야 할 듯요더운 여름 잘 보내겠습니다 항상 쓰던 제품이고 2017년 새로 나왔다고 해서 여러개 주문했는데 이 상품은 박스 포장이 안되어 있네요새로 사는 분들은 참고 하셔야 할 듯요그거 말고는 아직 써보지 않아서저렴하게 사서 그런가부다 하고 잘 쓰겠습니다
21,4,부드럽게 잘 발려요  다른 크림들은 백탁 현상이나 뻑뻑하게 발리는 것들이 있는데 이건 로션 같이 잘 발립니다 따로 클렌징 티슈 없이 물로 닦고 목욕할 때 한번 더 클렌징 워시 부드럽게 잘 발려요  다른 크림들은 백탁 현상이나 뻑뻑하게 발리는 것들이 있는데 이건 로션 같이 잘 발립니다 따로 클렌징 티슈 없이 물로 닦고 목욕할 때 한번 더 클렌징 워시 물로 닦아 주고 있어요그런데로 잘 닦기는 것 같구요용량도 넉넉해서 아기 한 철 바르는데 무리 없을 것 같네요
22,5,좋은 제품 다섯살 쯤부터 쓰기 시작해서 초등생인 지금까지 계속 쓰고 있습니다향이 좋기도 하고 익숙해서 아이가 거부감이 없어요 선팩트를 사줄까 하다가 그냥 튜브형을 샀는데초중생좋은 제품 다섯살 쯤부터 쓰기 시작해서 초등생인 지금까지 계속 쓰고 있습니다향이 좋기도 하고 익숙해서 아이가 거부감이 없어요 선팩트를 사줄까 하다가 그냥 튜브형을 샀는데초중생들이 요즘 팩트 들고다니며 바르는게 유행이어서아예 선팩트 제품으로 사줘도 좋겠단 생각이 들더라구요초중생 취향에 맞는 선팩트 케이스 디자인도 추가로나왔으면 좋겠습니다
23,5,자외선차단 확실히 최고여름이면 항상 쓰는 제품입니다 다른 제품에비해서 자외선 차단이 확실히 잘 되는것 같아요 다른 제품 선물 받은 것 쓰다가 아이들이 점점 까맣게 그을려서 다시 샀습니다 가격도 싸고 자외선 차단도 잘 되고 땀에도 잘 지워지지 않아요 대신 잘  씻어주셔야해요
24,5,늘 사용하는거예요끈적임도없고 촉촉하니 아이도 저도 만족하네요늘 사용하는거예요끈적임도없고 촉촉하니 아이도 저도 만족하네요
25,4,적당한 가격에 구매한 것 같아요 배송이 빠르게 오지는 않았는데 그냥 느리진 않고 적당하다 생각할 정도의 속도였어요왜인지는 모르겠는데 3개 구매했는데 하나는 뚜껑이 열려서 배송됐더적당한 가격에 구매한 것 같아요 배송이 빠르게 오지는 않았는데 그냥 느리진 않고 적당하다 생각할 정도의 속도였어요왜인지는 모르겠는데 3개 구매했는데 하나는 뚜껑이 열려서 배송됐더라구요은박 마개?가 있어서 문제는 없었지만 뭔가 찝찝한 느낌이였어여ㅋㅋㅋ 그리고 이거 배송오고나서 얼마 안 있다가 11로 세일하는거 발견해서 세상속상ㅠㅠ 그래도 올해 신상으로 와서 기분은 좋아요올해여름 선크림으로 잘 쓸 것 같아요!
26,5,다른 선크림 바르면 눈이 따가워서 매번 이것만 시켜요 제일 괜찮은거같아요 배송도 빨랐구요! 감사합니다다른 선크림 바르면 눈이 따가워서 매번 이것만 시켜요 제일 괜찮은거같아요 배송도 빨랐구요! 감사합니다
27,5,썬크림은 그린핑거만 사용해요 만족합니다 다른 화장품은 전혀 사용하지 않는데 썬크림은 꼭 바르거든요다른거 바르면 막 끈적이고 백탁 현상 생기는데 그린핑거 썬크림은그런게 전썬크림은 그린핑거만 사용해요 만족합니다 다른 화장품은 전혀 사용하지 않는데 썬크림은 꼭 바르거든요다른거 바르면 막 끈적이고 백탁 현상 생기는데 그린핑거 썬크림은그런게 전혀 없어요 최고입니다 끈적임도 없고 백탁도 없고 내 피부에 딱 맞음!태양을 피하고 싶으신분! 그린핑거로 해결하세욧!!
28,5,배송2일 걸렸어요다른 건 좋은데유통기간이22년도라 아쉽네요배송2일 걸렸어요다른 건 좋은데유통기간이22년도라 아쉽네요
29,5,날씨따뜻해서 구매해요날씨따뜻해서 구매해요
30,5,마스크 쓰고 다니는 아이 선크림 안발랐더니 얼굴에 마스크자국이 생겼네요 선크림 열심히 바르라고샀어요마스크 쓰고 다니는 아이 선크림 안발랐더니 얼굴에 마스크자국이 생겼네요 선크림 열심히 바르라고샀어요
31,4,외출때 바릅니다 좋아요외출때 바릅니다 좋아요
32,5,뽀송하니 딱좋습니다 내가찾던 타입이네요 재구매 희망합니다뽀송하니 딱좋습니다 내가찾던 타입이네요 재구매 희망합니다
33,5,맨날 쓰는 거라 믿고 시켰어요맨날 쓰는 거라 믿고 시켰어요
34,5,항상 이거 사용합니다 좋아요항상 이거 사용합니다 좋아요
35,5,두번째 구매입니다0 성인이지만 유아용선크림을 써야할정도로 민감성피부인데 트러블없이 잘 쓰고있어 두번째 구매를 했습니다 로드샵부터 백화점 브랜드 선크림을 써봤지만 너무 무겁고두번째 구매입니다0 성인이지만 유아용선크림을 써야할정도로 민감성피부인데 트러블없이 잘 쓰고있어 두번째 구매를 했습니다 로드샵부터 백화점 브랜드 선크림을 써봤지만 너무 무겁고 민감해서 그런지 잘 맞지않더라고요 더 좋은 선크림을 찾지 않는이상 계속 구매할 예정입니다
36,4,순해서 좋아요 15개월된 아가인데 피부가 약해서 뭘쓰기가 부담스러웠는데 전용폼없이 물에도 씻을 수 있어서 좋아요차단지수도 적당한것같아요저도 너무 높은거 쓰면 가끔 피부자극이 순해서 좋아요 15개월된 아가인데 피부가 약해서 뭘쓰기가 부담스러웠는데 전용폼없이 물에도 씻을 수 있어서 좋아요차단지수도 적당한것같아요저도 너무 높은거 쓰면 가끔 피부자극이 강하다고 생각했는데약한 아이피부에 딱인것같아요대신 백탁현상이 있고 약하구 순한만큼 자주 발라줘야겠어요
37,5,빨리받았어요 조아여빨리받았어요 조아여
38,4,야외나갈 때 가볍게 나가기 좋습니다 물로도 씻을 수 있으면 더 편할 것 같습니다야외나갈 때 가볍게 나가기 좋습니다 물로도 씻을 수 있으면 더 편할 것 같습니다
39,5,잘받았습니다전에 쓰던 썬크림은 바르면 얼굴이 하얗게 되고뻣뻣해서 쓰다 말다 하다 넘 오래되서 남았지만 버렸구요 아이와 같이 쓰려고 이제품 주문했는데배송이 엄청 빠르네요손등에 살짝 발랐는데 향도 좋고 끈적임도 없고 잘 쓰게 될거 같아요보내주신 샘플도 잘쓸께요
40,4,늘 주문하는 제품이예요늘 주문하는 제품이예요
41,4,마트 가격의 절반 선크림은 이것만 쓰는데 아주 촉촉한 것은 아니지만 자외선 차단은 잘 되는 것 같아요 저도 기초 화장 후에 바르고 다니기도 해요 피부가 민감한데 이건 괜찮아마트 가격의 절반 선크림은 이것만 쓰는데 아주 촉촉한 것은 아니지만 자외선 차단은 잘 되는 것 같아요 저도 기초 화장 후에 바르고 다니기도 해요 피부가 민감한데 이건 괜찮아요 마트가서 가격 보고 인터넷 구매 했네요 매년 펀하게 사용해요
42,5,제가쓰려고 샀어요 순해요제가쓰려고 샀어요 순해요
43,4,항상 쓰던거라 크림 로션은 다른 제품 쓰는데 선크림은 요게 좋다고 엄마들이 그러더라구요 작년에 이어 올해도 요골로ㅎㅎ 근데 배송 참늦게 발송해주셨고 택배사에서 무려 4일을항상 쓰던거라 크림 로션은 다른 제품 쓰는데 선크림은 요게 좋다고 엄마들이 그러더라구요 작년에 이어 올해도 요골로ㅎㅎ 근데 배송 참늦게 발송해주셨고 택배사에서 무려 4일을 잡고 있으셔서 주문하고 일주일 만에 받은듯요 그린핑거를 직구한 느낌적인 느낌은 몰까요ㅋㅋ
