,평점,본문
0,5,처음 몽디에스 제품 쓴게 파우더로션이에요 신랑이 땀이 많은 편이라 여름 마다 땀띠가 나서 이것 저것 검색하다가 써봤는데 정말 거짓말 안보태고 한 번 바르고는 엄청 가라앉았더라구요 처음 몽디에스 제품 쓴게 파우더로션이에요 신랑이 땀이 많은 편이라 여름 마다 땀띠가 나서 이것 저것 검색하다가 써봤는데 정말 거짓말 안보태고 한 번 바르고는 엄청 가라앉았더라구요 그 뒤로 떨어지게 무섭게 쟁여놓는 제품 중 하나고 아가 출산준비크림 클렌징 썬크림 등도 몽디에스꺼만 썼어요 그만큼 너무 좋아서  이번에도 파우더 로션 다 써가서 구입하려고 들어왔다가 썬팩트 있는거 보고 바로 같이 구입했어요! 기대반 설렘반으로 써보니 역시 ㅜㅜ 썬팩트도 딱 제가 찾던 백탁현상도 없고 눈따가움 없이 순하고 아가도 너무 좋아해요 심지어 촉촉하고 바를때 시원하더라구요  정말 몽디에스는 감동사랑이에요!! 좋은제품 감사합니다 4개의 포토리뷰4개의 포토리뷰4개의 포토리뷰4개의 포토리뷰
1,5,역시 몽디에스 ㅎ기분탓인건지 살짝 피부톤이 밝아지는것같아요타제품으로 썬크림사용했는데애기가 자꾸 눈을 비비기도 하고 아침에 발라줄때마다 울고불고해서 팩트로 찾아보다 겟!!일단 애역시 몽디에스 ㅎ기분탓인건지 살짝 피부톤이 밝아지는것같아요타제품으로 썬크림사용했는데애기가 자꾸 눈을 비비기도 하고 아침에 발라줄때마다 울고불고해서 팩트로 찾아보다 겟!!일단 애기가 너무 좋아해요단점이 있다면 시도때도없이 톡톡줘하고떼를 쓴다는것 ㅠㅡㅠ11할때 잘 구매해서 하나는 원에 킵해두고 하나는 집에서 사용하고있어요저녁에 씻을때도 깨끗하게 씻기는것같아요 ㅎ3개의 포토리뷰3개의 포토리뷰3개의 포토리뷰
2,4,5세 아이인데 좋아해요 매번 엄마꺼 들고 제 얼굴에 해줬었는데 자기 얼굴에 해도 되는게 생겨서 그런지 사줘서 고맙고 너무 행복하다고  ㅎㅎ그런데 케이스에 캐릭터 들어가 있으5세 아이인데 좋아해요 매번 엄마꺼 들고 제 얼굴에 해줬었는데 자기 얼굴에 해도 되는게 생겨서 그런지 사줘서 고맙고 너무 행복하다고  ㅎㅎ그런데 케이스에 캐릭터 들어가 있으면 좋겠다 싶은 아쉬움이 남아요 힛결국 제 스티커를 붙여 줬는데 이게 아쉬워 별 하나 빼요!3개의 포토리뷰3개의 포토리뷰3개의 포토리뷰
3,5,아이가 둘이라 각자 한개씩 이름붙여주니 더 애착을 가지고 좋아하네요엄마 화장하는 것 같다며 스스로 바르겠다고도 하고요아무래도 팩트형이라 얼굴 외에 다른데 바르는건 좀 불편해요아이가 둘이라 각자 한개씩 이름붙여주니 더 애착을 가지고 좋아하네요엄마 화장하는 것 같다며 스스로 바르겠다고도 하고요아무래도 팩트형이라 얼굴 외에 다른데 바르는건 좀 불편해요바디용은 따로 장만 해야겠어요무기자차라 클렌징 따로 안해도 된다고 하니 일상용으로 너무 좋네요저는 물론 깨끗이 닦아주고 싶어서 클렌징 워터고 샀지만요 ㅎㅎ올 여름 몽디에스와 잘 보내 보겠습니다!2개의 포토리뷰2개의 포토리뷰
4,5,이번여름이 햇빛이 쨍한 날이 많지않아서ㅜ 많이는 사용 못했어요ㅜ 11할때 구매했는데 지금 사진보는거처럼 중간은 다 쓴거같아요ㅎ바르기편하고 가벼워서 외출시 무조건 들고가요ㅎㅎㅎ아이이번여름이 햇빛이 쨍한 날이 많지않아서ㅜ 많이는 사용 못했어요ㅜ 11할때 구매했는데 지금 사진보는거처럼 중간은 다 쓴거같아요ㅎ바르기편하고 가벼워서 외출시 무조건 들고가요ㅎㅎㅎ아이 스스로 바르기도 편하구요ㅎ많이 찍어서 바르면 물로 씻을때 잘 안씻기는거같아요 저는 몽디에스바디워시로 살살 문질러서 씻어요32개의 포토리뷰2개의 포토리뷰
5,4,배송은 빠르게 해주셨는데 유효기간 지난게 와서다시 교환하느라 몇일 걸렸네요 그래도 빠른처리해주셔서 감사합니다백탁없이 촉촉하게 발라지는데 피부에 그대로 스며그는거 같아서 발랏는지 안배송은 빠르게 해주셨는데 유효기간 지난게 와서다시 교환하느라 몇일 걸렸네요 그래도 빠른처리해주셔서 감사합니다백탁없이 촉촉하게 발라지는데 피부에 그대로 스며그는거 같아서 발랏는지 안발랏지 모를정도로 얇게 발라져요 쿠션이라 편하네요
6,5,조아용 다른제품쓰다 갈아탔는데 이것도 좋네요 얼집서 실외활동이 있어서 급하게 샀는데 나중에 시킨 수딩젤 파우더로션과 같은날 배송왔어요  염려는 안해도된다하셨지만 아기물건이 이 더위조아용 다른제품쓰다 갈아탔는데 이것도 좋네요 얼집서 실외활동이 있어서 급하게 샀는데 나중에 시킨 수딩젤 파우더로션과 같은날 배송왔어요  염려는 안해도된다하셨지만 아기물건이 이 더위속에 돌고돌았단 생각에몇일 썬쿠션없이 실외활동한 생각에조금 화도 났었지만 제품사용해보니 풀리네요클렌지워터와 세뚜로 사용중입니다
7,4,썬스틱쿠션클린징 함께 구매했어요썬스틱 먼저 사용해봤는데피부예민한 첫째는 선크림 바르면 나는 두드러기가 이제품도 역시 올라오네요ㅠ제품자체는 냄새도 좋고 발림성도 좋아요클렌징 썬스틱쿠션클린징 함께 구매했어요썬스틱 먼저 사용해봤는데피부예민한 첫째는 선크림 바르면 나는 두드러기가 이제품도 역시 올라오네요ㅠ제품자체는 냄새도 좋고 발림성도 좋아요클렌징 워터는 잘씻기는건 아니고저자극이라 생각하고 쓸게용
8,4,빠른배송 덕분에 뜨거운 날씨에 아이랑 얼굴에 톡톡 두드리고 나갔어요작년에 쓰던 제품이랑펌핑형 방식이 달라서 설명이 필요할줄 알았더니 엄마가 화장하던거 유심히 본 덕분에 연습없이빠른배송 덕분에 뜨거운 날씨에 아이랑 얼굴에 톡톡 두드리고 나갔어요작년에 쓰던 제품이랑펌핑형 방식이 달라서 설명이 필요할줄 알았더니 엄마가 화장하던거 유심히 본 덕분에 연습없이도 사용할수있네요사용감은 조금 끈적이는 면이 있어요아이는 이래도 좋고 저래도 좋지만저한테는 조금 끈적이네요백탁은 거의없고 지울때도 꼼꼼한 세안이 필요하네요
9,5,민감성피부예요 주사도 있고 건조하기도 하고 선크림 안쓰고 맨얼굴이어야 좋지만 햇살받아도 피부가 울긋불긋 난리나서 찾다가 구매했는데 성분도 좋고 민감한 제 피부에 잘 맞아서 다행이민감성피부예요 주사도 있고 건조하기도 하고 선크림 안쓰고 맨얼굴이어야 좋지만 햇살받아도 피부가 울긋불긋 난리나서 찾다가 구매했는데 성분도 좋고 민감한 제 피부에 잘 맞아서 다행이예요 선크림을 바르면 건조한건 어쩔수 없는데 그나마 건조한 정도가 다른 제품 발랐을때보다 심하진 않은거 같아요 바르면 톤보정도 되서 입술만 바르면 화장한것 같고 좋아요 재구매합니다
10,5,주문하고 다음날 받았어요 햇빛 쨍한날 안바르고 나갔더니 벌써 얼굴 팔 다 타버려서ㅜㅜ급하게 주문했어요 아이 치약 바디워시 세제 다 몽디에스꺼 쓰는데 썬쿠션은 처음 주문했주문하고 다음날 받았어요 햇빛 쨍한날 안바르고 나갔더니 벌써 얼굴 팔 다 타버려서ㅜㅜ급하게 주문했어요 아이 치약 바디워시 세제 다 몽디에스꺼 쓰는데 썬쿠션은 처음 주문했어요ㅎ썬쿠션 뚜껑 포장 다 예쁘네요ㅎㅎ선물용으로도 좋을것같아요ㅎ엄청 촉촉해요 살짝 얼굴이 하애지는 효과도있네요ㅎ물에도 잘 씻기는데 저는 바디워시 살짝 발라서 씻겨주고있어요 11에 이가격이면 너무 좋은거같아요 올 여름은 몽디에스로 보내면 될것같아요3
11,4,하나는 아이 하나는 제가 쓰고 있어요 퍼프로 발라서 편하긴 한데 세안은 영 불편하네요ㅜ 어른은 클렌징 오일 사용하면 된다지만 아이는 아이세정제로만 닦으면 그대로 남아있어서 다른하나는 아이 하나는 제가 쓰고 있어요 퍼프로 발라서 편하긴 한데 세안은 영 불편하네요ㅜ 어른은 클렌징 오일 사용하면 된다지만 아이는 아이세정제로만 닦으면 그대로 남아있어서 다른 브랜드 클렌징 워터 사서 이중세안 시켜주고 있네요 다행히 아이가 거부감없이 클렌징하고 있긴한데 다음엔 물세안 가능한 제품으로 구입할래요
12,5,역시 몽디에스애기가 일반 썬크림은 거부하는데 엄마 화장품같은지 예쁘다 하자며 스스로톡톡톡하고 좋아하네요저는 향에 엄청 예민하고 중요하게 생각해요몽디에스가 향이 좋은건 역시 몽디에스애기가 일반 썬크림은 거부하는데 엄마 화장품같은지 예쁘다 하자며 스스로톡톡톡하고 좋아하네요저는 향에 엄청 예민하고 중요하게 생각해요몽디에스가 향이 좋은건 아니예요후기좋고 유해성분없다는 아기화장품에서 나는 향??!! 살짝 약냄새같기도 한데 막 애기몸에서 날정도로 향이 강한것도 아니고향보단 보습력이나 기능성에 집중하게되는아기화장품이라 향이 별로여서? 더 좋아요 ㅋ
13,5,35갤 아이가 아침마다 혼자서 톡톡 바르며 챙길수있으니 너무 좋아요백탁 없는 제품을 아주 얼굴이 허얘질때까지 발라서 당황스럽긴 하지만 확실히 바르고 야외활동하면 얼굴이 많이 타지35갤 아이가 아침마다 혼자서 톡톡 바르며 챙길수있으니 너무 좋아요백탁 없는 제품을 아주 얼굴이 허얘질때까지 발라서 당황스럽긴 하지만 확실히 바르고 야외활동하면 얼굴이 많이 타지않아요야외활동하다 오후에도 바르기 쉽게 스틱형도 얼른 구매해야겠어요
14,5,알레르기 때문에 순한 썬크림 찾다가 후기 좋아서 구매했어요무기자차라서 하얗긴 해요 자극 별로 없고 괜찮은 것 같아요!사용은 편해요 평소 쌩얼로 다닐 때 사용하려고 한거라 화장알레르기 때문에 순한 썬크림 찾다가 후기 좋아서 구매했어요무기자차라서 하얗긴 해요 자극 별로 없고 괜찮은 것 같아요!사용은 편해요 평소 쌩얼로 다닐 때 사용하려고 한거라 화장할 때 밀리는지는 모르겠어요요즘처럼 마스크 쓰고 다닐 때 좋아요
15,4,아기 쓰는 거지만 피부 예민한 제가 쓰려고 구입했어요마스크 쓰고 다니니 화장도 하지 않고여름이라 썬케어는 해야할 듯  해서요일단 촉촉하고 백탁없어 좋아요 피부 자극도 없고약간 쿨링아기 쓰는 거지만 피부 예민한 제가 쓰려고 구입했어요마스크 쓰고 다니니 화장도 하지 않고여름이라 썬케어는 해야할 듯  해서요일단 촉촉하고 백탁없어 좋아요 피부 자극도 없고약간 쿨링감도 느껴져요다만 사용하다보니 양이 좀 적긴 한 것 같네요
16,5,세수할때 꼼꼼히 씻기는게 좀 힘들지만 이건 발라줘야합니다! 하나는 애기가 쓰고 하나는 제가 써요 밖에 오래있는거 아니라면 어른도 가능합니다 사용하기도 편리하고 로션 바디워시 세수할때 꼼꼼히 씻기는게 좀 힘들지만 이건 발라줘야합니다! 하나는 애기가 쓰고 하나는 제가 써요 밖에 오래있는거 아니라면 어른도 가능합니다 사용하기도 편리하고 로션 바디워시 다 몽디에스꺼 써서 믿음이가는 브랜드입니다
17,5,아이가 화장하는것 같다며 좋아해요 구지 제가 챙겨서 발라주지 않아도 자기가 알아서 잘바르네요7살5살 짜리 남동생한테도 자기가 화장해준다며 발라주고 그것만 해도 편한데 11 행아이가 화장하는것 같다며 좋아해요 구지 제가 챙겨서 발라주지 않아도 자기가 알아서 잘바르네요7살5살 짜리 남동생한테도 자기가 화장해준다며 발라주고 그것만 해도 편한데 11 행사까지 하니 앞으로 쭉 구매 예정각입니다 ㅎㅎ
18,4,묽지 않아서 발림성은 보통이에요 백탁이 별로 없는건 좋네요 양은 적어 보입니다 애들이 더운데 선크림바르고 마스크착용하니 작은 두드러기 같은 것들이 올라와서 더 순한 성분의 선크림 묽지 않아서 발림성은 보통이에요 백탁이 별로 없는건 좋네요 양은 적어 보입니다 애들이 더운데 선크림바르고 마스크착용하니 작은 두드러기 같은 것들이 올라와서 더 순한 성분의 선크림 찾다가 구매했어요 두드러기가 덜 했으면 좋겠네요
19,5,아기가 아제 돌 지나서 여름이 다가오니선크림을 사용해야 할것 같아서 구매했어요선스틱과 많이 고민했는데스틱은 골고루 바르기 힘들것 같아서쿠션으로 샀어요쿠션으로 바를때 아기가 가만히 아기가 아제 돌 지나서 여름이 다가오니선크림을 사용해야 할것 같아서 구매했어요선스틱과 많이 고민했는데스틱은 골고루 바르기 힘들것 같아서쿠션으로 샀어요쿠션으로 바를때 아기가 가만히 있는게너무 신기하네요 ㅋㅋㅋ
20,4,30개월 남아 아기 발라주려고 샀어요 종종 제가 화장하는 모습을 따라할때가 있어서 쿠션형으로 샀어요 아직 아기는 안써보고 어른인 제가 먼저 써봤는데  민감형인 제가 써도 좋30개월 남아 아기 발라주려고 샀어요 종종 제가 화장하는 모습을 따라할때가 있어서 쿠션형으로 샀어요 아직 아기는 안써보고 어른인 제가 먼저 써봤는데  민감형인 제가 써도 좋을정도로 선크림이 순하고 성분이 좋은것 같네요
21,5,일단 마구 하얗게 백탁현상이 일어나는건 아니네요바르면 이쁘게 환해지는 느낌이랄까?발라줄때마다 딸램이 엄마같이 화장하는거라고 무척 좋아합니다 그 모습에 마냥 기분 일단 마구 하얗게 백탁현상이 일어나는건 아니네요바르면 이쁘게 환해지는 느낌이랄까?발라줄때마다 딸램이 엄마같이 화장하는거라고 무척 좋아합니다 그 모습에 마냥 기분 좋아지는 그런 느낌?ㅎㅎㅎ배송할때도 포장 영상까지 보내주시니 더 신뢰가 가는ㅎㅎㅎ 그게 뭐라고 기분이 좋아지더군요만족합니다내년에도 또 사러올께요아니 다쓰면 또 올께요
22,5,4살 딸아이가 너무 좋아해요 하하택배받고 어제 하루종일 집에서 톡톡 바르고있네요ㅎㅎㅎ엄마가 이거 사줘서 너무 기쁘고 행복하대요ㅋㅋ 눈시림도 없는거같고 차단 지수도 맘에 들고 무엇보4살 딸아이가 너무 좋아해요 하하택배받고 어제 하루종일 집에서 톡톡 바르고있네요ㅎㅎㅎ엄마가 이거 사줘서 너무 기쁘고 행복하대요ㅋㅋ 눈시림도 없는거같고 차단 지수도 맘에 들고 무엇보다 애가 너무 좋아하니 아주 만족합니다
23,5,봄볕에 자외선에 아이얼굴 상할까 구매했어요피부가 예민한 아이라 로션한번 잘못발라도 트러블이 생기는데 선쿠션오고 나흘째 사용중인데 아무 이상없이 잘 쓰고있네요 아침 학교가기전 톡톡봄볕에 자외선에 아이얼굴 상할까 구매했어요피부가 예민한 아이라 로션한번 잘못발라도 트러블이 생기는데 선쿠션오고 나흘째 사용중인데 아무 이상없이 잘 쓰고있네요 아침 학교가기전 톡톡 두드려주는 재미에 잊지도않고 사용중입니다
24,5,조카 사줬는데 너무 좋아하네요조카 사줬는데 너무 좋아하네요2개의 포토리뷰2개의 포토리뷰
25,5,양이 좀 적은거 같아 아쉽네요성분이 좋아  딸아이 썬쿠션으로 준비했답니다 좋은가격 감사합니다양이 좀 적은거 같아 아쉽네요성분이 좋아  딸아이 썬쿠션으로 준비했답니다 좋은가격 감사합니다
26,5,예전에도 몽디에스 제품 사용하다 다시 쓰네요아이가 좋아해요예전에도 몽디에스 제품 사용하다 다시 쓰네요아이가 좋아해요
27,3,아토피가 재발한 고딩 아들 주려고 샀는데잘쓸께요아토피가 재발한 고딩 아들 주려고 샀는데잘쓸께요
28,4,순한듯 괜찮습니다아이가 아닌 저를 위해 샀어요ㅎ순한듯 괜찮습니다아이가 아닌 저를 위해 샀어요ㅎ
29,4,여름이 거의지나가지만 가을볕이 쎄서 구매했네요 11이라 지인도 나눠주고요 유통기한에 내년 초여름까지라 내년 한여름엔 사용하기 걸려서 ㅋ 발림성 좋아요 내년에 재구매 해야겠어요 여름이 거의지나가지만 가을볕이 쎄서 구매했네요 11이라 지인도 나눠주고요 유통기한에 내년 초여름까지라 내년 한여름엔 사용하기 걸려서 ㅋ 발림성 좋아요 내년에 재구매 해야겠어요 ㅋㅋ2개의 포토리뷰2개의 포토리뷰
30,5,아가 선큐션 많이 써봤는데요 촉촉함은 조금 덜 해요 바르고 나면 얼굴이 반짝 거릴정도로 촉촉하진 않지만 휴대하기 편해서 가방에 쏙 넣어다니며 자주자주 발아주고 있어요아가 선큐션 많이 써봤는데요 촉촉함은 조금 덜 해요 바르고 나면 얼굴이 반짝 거릴정도로 촉촉하진 않지만 휴대하기 편해서 가방에 쏙 넣어다니며 자주자주 발아주고 있어요2개의 포토리뷰2개의 포토리뷰
31,4,아기들도사용한다고해서구매했는데 마크해요 ㅠㅠ아기들도사용한다고해서구매했는데 마크해요 ㅠㅠ
32,5,아이가 혼자 바르면서 사용하기에 너무좋아요원플원이라 엄마와 딸이 같이 사용하고있어요아이가 혼자 바르면서 사용하기에 너무좋아요원플원이라 엄마와 딸이 같이 사용하고있어요3개의 포토리뷰3개의 포토리뷰3개의 포토리뷰
33,4,아직 사용전이긴 한데 크림 발라주는 것보다 편할 것 같아요   그리고 요즘 아기가 엄마 쿠션 바르는 거 흉내 많이 내는데 보면 좋아할듯요 ㅋㅋSPF 지수도 높고 성분 좋다고 해서 아직 사용전이긴 한데 크림 발라주는 것보다 편할 것 같아요   그리고 요즘 아기가 엄마 쿠션 바르는 거 흉내 많이 내는데 보면 좋아할듯요 ㅋㅋSPF 지수도 높고 성분 좋다고 해서 샀어요아기 피부는 소중하니까요3개의 포토리뷰3개의 포토리뷰3개의 포토리뷰
34,5,일반 썬크림보단 순하겠다고 생각하고 써요일반 썬크림보단 순하겠다고 생각하고 써요
35,5,일반 썬크림보단 순허깄지 하고 써요일반 썬크림보단 순허깄지 하고 써요
36,4,사용하기 좋아요 엄마들 사이에서 믿쓰 몽디에스라 구매 잘했네요 근데 양이 좀 작은거 같아 별하나 뺐어요사용하기 좋아요 엄마들 사이에서 믿쓰 몽디에스라 구매 잘했네요 근데 양이 좀 작은거 같아 별하나 뺐어요
37,5,성분이좋은제품을골라쓰는데약간매트한감이있네요 좀더사용해봐야할듯자극은없었어요성분이좋은제품을골라쓰는데약간매트한감이있네요 좀더사용해봐야할듯자극은없었어요
38,4,늘 쓰던 제품입니다  유통기항 21년 5월까지네요그럭저럭 괜찮아요늘 쓰던 제품입니다  유통기항 21년 5월까지네요그럭저럭 괜찮아요
39,5,야외에 나갔을때 덧바르기좋아요스틱보다 좋으네요야외에 나갔을때 덧바르기좋아요스틱보다 좋으네요
40,5,초딩아이 직접 등교전에 바르라고 줬네요백탁없고 잘발려요리필있음 좋겠어요초딩아이 직접 등교전에 바르라고 줬네요백탁없고 잘발려요리필있음 좋겠어요
41,4,아이 피부가 약해서 순하다는 왠만한 것들도 안되는데 요 제품은 괜찮네요아이 피부가 약해서 순하다는 왠만한 것들도 안되는데 요 제품은 괜찮네요
42,4,자극적이지 않고 번들거림없이 사용하기 좋아요자극적이지 않고 번들거림없이 사용하기 좋아요
43,5,재구매예요 괜찮아요 아이도 잘 바르고요재구매예요 괜찮아요 아이도 잘 바르고요
44,5,아이둘인데 두개 사서 하나씩 줬어요 3살 4살 애들인데 직접 바르려고 하네요끈적이지않게 잘 발리고 물로 씻어도 잘 닦이는것 같아요 많이 바를땐 세안제 쓰고요재구매 예정입니다아이둘인데 두개 사서 하나씩 줬어요 3살 4살 애들인데 직접 바르려고 하네요끈적이지않게 잘 발리고 물로 씻어도 잘 닦이는것 같아요 많이 바를땐 세안제 쓰고요재구매 예정입니다2개의 포토리뷰2개의 포토리뷰
45,5,평이좋아서 구매해봅니다평이좋아서 구매해봅니다
46,5,항상잘쓰고있어요!!항상잘쓰고있어요!!
47,3,아이가 하두 화장하는거 사달라해서요걸루 사줬네요ㅡㅜㅡ일단은 아이용이라니까믿고 써보게 나두는 중입니다나쁘진 않은거 같아요썬쿠션이라햇빛차딘된다니아이가 하두 화장하는거 사달라해서요걸루 사줬네요ㅡㅜㅡ일단은 아이용이라니까믿고 써보게 나두는 중입니다나쁘진 않은거 같아요썬쿠션이라햇빛차딘된다니ㅅㅇㅅ
48,5,좋다 얘기들어서샀어요 트러블없이 잘 쓰면 좋겠어요좋다 얘기들어서샀어요 트러블없이 잘 쓰면 좋겠어요
49,5,얼굴톤도 살짝 환해지면서 자외선 차단도 되고 좋응것같아요ㅎㅎ 사용도 편합니다!ㅎ얼굴톤도 살짝 환해지면서 자외선 차단도 되고 좋응것같아요ㅎㅎ 사용도 편합니다!ㅎ
50,5,지인추천으로 구매했는데 백탁도 없고 싹 쓰며들고 맘에 듭니다지인추천으로 구매했는데 백탁도 없고 싹 쓰며들고 맘에 듭니다2개의 포토리뷰2개의 포토리뷰
51,3,애기들 껀데 바르니 백태현상이 있네요  촉촉하긴한데   이렇게 되면  애기들 눈에 흘러 들어갈것 같아 보여요 애기들 껀데 바르니 백태현상이 있네요  촉촉하긴한데   이렇게 되면  애기들 눈에 흘러 들어갈것 같아 보여요 2개의 포토리뷰2개의 포토리뷰
52,5,배송 품질 모든면에서 만족합니다배송 품질 모든면에서 만족합니다
53,5,4살 아이 손에 딱 맞아요 쿠션 닫을때 딱 소리가 나서 아이에게 소리 날때까지 꼭 눌러 덮으라고 하니 잘하네요 아이 살성이 약한데 트러블 없이 잘 쓰고 있어요4살 아이 손에 딱 맞아요 쿠션 닫을때 딱 소리가 나서 아이에게 소리 날때까지 꼭 눌러 덮으라고 하니 잘하네요 아이 살성이 약한데 트러블 없이 잘 쓰고 있어요2개의 포토리뷰2개의 포토리뷰
54,3,아이들이좋아하고 물에잘 씻기는느낌입니다아이들이좋아하고 물에잘 씻기는느낌입니다2개의 포토리뷰2개의 포토리뷰
55,5,발림성도 좋고 휴대하기도 편해서 좋아요발림성도 좋고 휴대하기도 편해서 좋아요
56,4,향 괜찮고 아직까지 트러블 나는 것이 없어서 괜찮은 것 같애요향 괜찮고 아직까지 트러블 나는 것이 없어서 괜찮은 것 같애요
57,5,최근에 선쿠션 잘못사서 피부가 안좋아졌었는데 이거는 아무라 발라도 괜찮을거같아요 다음에 또 살게요!최근에 선쿠션 잘못사서 피부가 안좋아졌었는데 이거는 아무라 발라도 괜찮을거같아요 다음에 또 살게요!
58,4,아이가 좋아할 줄 알았는데로션바르는거 싫어하듯 이것도 불호라 아쉬워요액상타입보다 잘 발라졌는지 모르겠어요백탁현상이 별로 없어서 그런거 같기도요아이가 좋아할 줄 알았는데로션바르는거 싫어하듯 이것도 불호라 아쉬워요액상타입보다 잘 발라졌는지 모르겠어요백탁현상이 별로 없어서 그런거 같기도요
59,5,햇빛에 살이 많이 타기도 하고 성분도 좋다고하여 구매하게 되었어요 튜브형보다 팩트처럼 스스로 바를 수 있어 아이가 외출할때 먼저 찾고 바르려고 해요햇빛에 살이 많이 타기도 하고 성분도 좋다고하여 구매하게 되었어요 튜브형보다 팩트처럼 스스로 바를 수 있어 아이가 외출할때 먼저 찾고 바르려고 해요2개의 포토리뷰2개의 포토리뷰
60,5,아이한태 쓰려고 주문했어요 얼굴에 로션 바르기를 싫어해서 쿠션으로 주문했는데 아직 안써봤지만 잘 발렸으면 좋겠네요아이한태 쓰려고 주문했어요 얼굴에 로션 바르기를 싫어해서 쿠션으로 주문했는데 아직 안써봤지만 잘 발렸으면 좋겠네요
61,5,아이스스로 잘바름ㅋㅋ화장놀이 하는것처럼ㅋㅋ아이스스로 잘바름ㅋㅋ화장놀이 하는것처럼ㅋㅋ
62,5,재구매입니다 자극적이지 않고 좋아요재구매입니다 자극적이지 않고 좋아요
