,평점,본문
0,5,여름이면 항상 아이 위해 준비해요남아 인데 얼굴에 로션바르면 가만있질 않는데이걸로 두들겨 주면 잼있어하고 가만있어요 혼자 스스로 바르면서 놀기도하는데 그러면 금방 없어 지네요ㅋㅋㅋ여름이면 항상 아이 위해 준비해요남아 인데 얼굴에 로션바르면 가만있질 않는데이걸로 두들겨 주면 잼있어하고 가만있어요 혼자 스스로 바르면서 놀기도하는데 그러면 금방 없어 지네요ㅋㅋㅋ사이즈는 보통 팩트 크기입니다용량은 이렇게 한통사면 아가얼굴만바르고 딱 여름한철쓰면 끝나는 용량이네요배송은7일걸렸는데 출고는 빨랐는데배달이 늦었네요  자외선 강해지기 전에 미리 준비한거라 늦게와도 갠차났어요저렴한가격에잘샀어요퍼프가 하나더 들어서 좋네요많이 파시고 번창하세요
1,5,배송 오자마자 딸 아이가 바로 배송 오자마자 딸 아이가 바로 사용하였는데 10분 안되서 사용한 얼굴 전체 붉게 올라왔어요 ㅠㅠ그래서 바로 세수하고 그 다음부터 사용을 안하고 있어요이런적이 처음이라서 완전 당황스럽습니다가능하면 테스트후 구매 하시기 바랍니다
2,5,6살 아이가 사용하려고 구입했습니다먼저 디자인6살 아이가 사용하려고 구입했습니다먼저 디자인으로 노랑색이 예뻐서 마음에 들어합니다언니가 있어서 쿠션을 가지고 싶어했는데저도 아토팜 제품이라 믿고 사주었답니다언니따라 클렌징까지 열심히 하며 좋아하는 모습을 보니잘 구입한 것 같습니다
3,5,여름도다가오고바깥놀이도 많이 나가게되서유아용 썬팩트여름도다가오고바깥놀이도 많이 나가게되서유아용 썬팩트가 필요했는데유아용은 아토팜처럼 믿음이가는제품이없는것 같아요콩순이부터 현재 타요까지아이들이 좋아할만한 캐릭터로깜찍하고 좋아요발림도 좋고 금방 흡수되고 반짝반짝 광이나는것 같아서 더 예뻐보여요
4,5,착한 성분이라 믿을 수 있고 순하고 백탁현상도 없어 주착한 성분이라 믿을 수 있고 순하고 백탁현상도 없어 주황 콩순이 리필해서 계속 쓰다 오쇼핑에서 좋은 가격으로 재구매 합니다근데 퍼프가 선크림을 다 먹어 들어갔는 지 세척시 속에 엄청난 양의 크림이 계속 나와 깜짝 놀랐어요얼굴에도 잘 도포되는 거 맞는 거죠?
5,5,날씨가 좋아지면서 밖에서 보내는 시간이 많아질 딸을 위날씨가 좋아지면서 밖에서 보내는 시간이 많아질 딸을 위해서 구입했어요 오자마자 콩순이 화장품 이라면서 톡톡! 발라보고 좋아하네요 냄새는 다른 제품들 처럼 좋은 향기가 나거나 하지는 않고 약간 아토팜 로션 냄새? 비슷하게 나요! 하얗게 발리거나 하지 않아서 좋고 번들거리지도 않아요
6,5,애들 쓰라고 샀어요 사은품을 엄청 많이 주셔서 고맙습니다애들 쓰라고 샀어요 사은품을 엄청 많이 주셔서 고맙습니다2개의 포토리뷰2개의 포토리뷰
7,4,썬팩트는 첨시켜봐요 일단 케이스가 넘귀엽네요 6살딸아이가 무척기다리고있어요 자기꺼라구 오묜 만지지말라구 ㅋㅋㅋ썬팩트는 첨시켜봐요 일단 케이스가 넘귀엽네요 6살딸아이가 무척기다리고있어요 자기꺼라구 오묜 만지지말라구 ㅋㅋㅋ
8,5,저렴하게 잘 샀습니다 저렴하게 잘 샀습니다 
9,5,완전 좋아요!! 순해서 샀어요케이스도 귀여워요 ㅎㅎ완전 좋아요!! 순해서 샀어요케이스도 귀여워요 ㅎㅎ
10,5,애기 발라주기 편할듯해서 샀어요애기 발라주기 편할듯해서 샀어요
11,4,아이가 자외선차단제가 필요해서 주문해요 아직 안써봤지만 아토팜이라 믿고 써볼께요아이가 자외선차단제가 필요해서 주문해요 아직 안써봤지만 아토팜이라 믿고 써볼께요
12,5,배송빠르고 사은품도 잘쓸게요배송빠르고 사은품도 잘쓸게요
13,5,잘받았습니다 감사합니다잘받았습니다 감사합니다
14,5,발림이좋아서 잘쓰게돼요발림이좋아서 잘쓰게돼요
15,4,잘 받앗습니다 아이들이 수시로 찍어 바르는걸 좋아해서 구매햇어요 아이도 좋아하네요 근데 선팩트로 구매를 햇는데 선쿠션이네요 ㅜ 아토팜에서 네임을 그렇게 정해서 판매하네요 잘 받앗습니다 아이들이 수시로 찍어 바르는걸 좋아해서 구매햇어요 아이도 좋아하네요 근데 선팩트로 구매를 햇는데 선쿠션이네요 ㅜ 아토팜에서 네임을 그렇게 정해서 판매하네요 구매하시는 분들 참고하세요2개의 포토리뷰2개의 포토리뷰
16,5,맘에들어요 좋아요!맘에들어요 좋아요!
17,5,6세 남자 아인데 화장하듯 놀이처럼 바를수 있어 아이 스스로 하여 만족함6세 남자 아인데 화장하듯 놀이처럼 바를수 있어 아이 스스로 하여 만족함
18,5,아이들이 좋아해요톡톡 찍어바르는게 재미있나봐요아이들이 좋아해요톡톡 찍어바르는게 재미있나봐요
19,5,아이가좋아해요 아토팜꺼라 순할거라믿고 샀어요아이가좋아해요 아토팜꺼라 순할거라믿고 샀어요
20,4,아직효과는모르겠지만 애들이넘넘좋아해요아직효과는모르겠지만 애들이넘넘좋아해요2개의 포토리뷰2개의 포토리뷰
21,5,코로나때문에 별로나가질못해 사용못했지만집에서 갖고놀며 잼나했었어요많이파세요코로나때문에 별로나가질못해 사용못했지만집에서 갖고놀며 잼나했었어요많이파세요
22,3,좋은데  클렌징이 좀 아쉽네요 아이들이라 비누로만 씻는데 잘 안씻겨지고 남는 느낌이 들어요좋은데  클렌징이 좀 아쉽네요 아이들이라 비누로만 씻는데 잘 안씻겨지고 남는 느낌이 들어요
23,5,배송이 빨라요 가격도 만족합니다배송이 빨라요 가격도 만족합니다
24,5,화장하는 기분들어서 그런지 애기들이 혼자서도 잘 해요잘쓸게요!화장하는 기분들어서 그런지 애기들이 혼자서도 잘 해요잘쓸게요!
25,5,좋으네요 쓰기도편하고 아이들휴가가서 놀리다 해변에서 모래묻은손으로 다시안마지고 톡톡 발라줄수있어더좋았어요좋으네요 쓰기도편하고 아이들휴가가서 놀리다 해변에서 모래묻은손으로 다시안마지고 톡톡 발라줄수있어더좋았어요
26,5,유통기한도 길고 좋네요아이가 캐릭터가 마음에 드는지 정말 좋아해요만족합니다유통기한도 길고 좋네요아이가 캐릭터가 마음에 드는지 정말 좋아해요만족합니다
27,5,딸이 좋아해요 선크림 뭉치지 않딸이 좋아해요 선크림 뭉치지 않고 편하고 쉽게 바를 수 있어 더 좋아요
28,4,골고루 바르기 힘든거 같아요아이는 화장하는 기분으로 바를떼마다 좋아해때마다 좋아해요골고루 바르기 힘든거 같아요아이는 화장하는 기분으로 바를떼마다 좋아해때마다 좋아해요
29,4,초등딸에게 주려고 구입했어요성분좋아서 안심이네요초등딸에게 주려고 구입했어요성분좋아서 안심이네요
30,5,좋아요 아이들 잘 발라주고 있어요!좋아요 아이들 잘 발라주고 있어요!
31,5,귀여워요딸이 너무 좋아해요귀여워요딸이 너무 좋아해요
32,5,우리 애기 필수템입니다우리 애기 필수템입니다
33,5,사용하기 편합니 다사용하기 편합니 다
34,5,딸이너무 조아해요 다음에 또 이용할게요딸이너무 조아해요 다음에 또 이용할게요
35,5,고민하다 샀는데 완전만족합니다고민하다 샀는데 완전만족합니다
36,5,잘 쓰고 있어요 아이가 조아해요잘 쓰고 있어요 아이가 조아해요
37,5,쓰기 편리하고 아이가 좋아해요쓰기 편리하고 아이가 좋아해요
38,3,아직 두번정도 밖에 쓰지 않아서 더써봐야겠지만 일단은 밀리지않고 아이가 재미있어하네요팩트라서 스스로 바를수 있어서 편하네요얼굴에 바르니 색감은 화장한듯 하얗게 되요아직 두번정도 밖에 쓰지 않아서 더써봐야겠지만 일단은 밀리지않고 아이가 재미있어하네요팩트라서 스스로 바를수 있어서 편하네요얼굴에 바르니 색감은 화장한듯 하얗게 되요
39,3,아이들은 좋아하는데 양이 적어도 적어도 너무 적네요아이들은 좋아하는데 양이 적어도 적어도 너무 적네요
40,4,발림성은 좋네요향은 그닥발림성은 좋네요향은 그닥
41,5,아이가 스스로 잘 바르네요아이가 스스로 잘 바르네요
42,5,차단효과 너무 좋아요차단효과 너무 좋아요
43,4,배송 빠르네요 아토팜 바디워시나 크림은 써봤는데 선팩트는 처음이에요 아직 사용해보기 전인데 아이한테 잘 맞으면 좋겠네요배송 빠르네요 아토팜 바디워시나 크림은 써봤는데 선팩트는 처음이에요 아직 사용해보기 전인데 아이한테 잘 맞으면 좋겠네요
44,4,날이뜨거워져서 아기썬크림 알아보다가 지인추천받고사봣네요 팩트라편하고좋을꺼같아요ㅋ날이뜨거워져서 아기썬크림 알아보다가 지인추천받고사봣네요 팩트라편하고좋을꺼같아요ㅋ
45,5,애들 쓰려고 구매했어요애들 쓰려고 구매했어요
46,5,편하게 쓰기 좋습니다편하게 쓰기 좋습니다
47,5,아이들이 편하게 쓸수 있어요아이들이 편하게 쓸수 있어요
48,5,초딩 넘 좋아하네요  잘 쓰고있어요초딩 넘 좋아하네요  잘 쓰고있어요
49,5,자외선 차단이 정말 잘 됩니다자외선 차단이 정말 잘 됩니다
50,5,배송 빠르고 제품 저렴하네요배송 빠르고 제품 저렴하네요
51,5,향도 조아요 너무 귀여워요향도 조아요 너무 귀여워요
52,5,아이가 좋아해요아이가 좋아하는데 바르고 꼼꼼하 세안하는데도 살짝 뭐가 올라오네요
53,5,아이가 스스로 쓰게하려고 팩트 타입으로아이가 스스로 쓰게하려고 팩트 타입으로
54,5,여자애들이라 팩트 형태를 좋아하네요여자애들이라 팩트 형태를 좋아하네요
55,5,아이들 밖에 나가기전 필수예요 아이들 밖에 나가기전 필수예요 
56,5,캐릭터도 귀엽고 잘쓸게요캐릭터도 귀엽고 잘쓸게요
57,5,어린이날을 맞아 교회 유치부 친구들 선물로 구입했어요 마침 행사할때 주문해서 크림 로션 샘플들 많이 받았네요 저렴하게 잘 산것같아요어린이날을 맞아 교회 유치부 친구들 선물로 구입했어요 마침 행사할때 주문해서 크림 로션 샘플들 많이 받았네요 저렴하게 잘 산것같아요
58,5,최저가로 구매했어요 샘플도 주셔서 좋어요최저가로 구매했어요 샘플도 주셔서 좋어요
59,5,아이들이 편하게 톡톡 펴바를수 아이들이 편하게 톡톡 펴바를수 있어서 최애템으로 생각하는 썬팩트예요저렴한 가격에 잘 사서 사용중입니다
60,4,아이가 좋아하네요안에 고형인줄 알았는데 썬크림이 들어있음어떻게 짜는지 몰라서 한참 해 봤음아이가 좋아하네요안에 고형인줄 알았는데 썬크림이 들어있음어떻게 짜는지 몰라서 한참 해 봤음
61,5,팩트그림이 귀여워서 딸이 골랐어요사은품도 많이 챙겨주시고너무 잘받았습니다팩트그림이 귀여워서 딸이 골랐어요사은품도 많이 챙겨주시고너무 잘받았습니다
62,5,위생적이고 간편하게 바를 수 있위생적이고 간편하게 바를 수 있어 좋아요 자외선 차단도 확실하네요
63,5,밖을 나갈수가 없어서 아직 써 보진 못했지만 믿고 구매했습니다밖을 나갈수가 없어서 아직 써 보진 못했지만 믿고 구매했습니다
64,5,디자인이 이쁘네요 아이들이 사용하기편해요디자인이 이쁘네요 아이들이 사용하기편해요
65,5,아이들이 너무 좋아해요 저렴하게 잘 샀어요아이들이 너무 좋아해요 저렴하게 잘 샀어요
66,5,항상 아토팜 써요샘플도 많이 주셨네요항상 아토팜 써요샘플도 많이 주셨네요
67,4,향이 좀 이상하지만 아이가 좋아해요향이 좀 이상하지만 아이가 좋아해요
68,3,아이들이 귀엽다고 좋아하더라구요아이들이 귀엽다고 좋아하더라구요
69,5,아이가 넘좋아하네요 맘에들어ㅛ아이가 넘좋아하네요 맘에들어ㅛ
70,5,조슴씩 알맞게 나오니까 좋아요조슴씩 알맞게 나오니까 좋아요
71,5,아이가 너무 좋아합니다아이가 너무 좋아합니다
72,5,사은품도 많고 조아요 ㅎ사은품도 많고 조아요 ㅎ
73,5,아이들이 좋아합니다아이들이 좋아합니다
74,5,아이가 너무좋아해요아이가 너무좋아해요
75,5,자매님들이 정말 애정하고 계십니다씻고나면 보내주신 로션샘플만 바르구요ㅎ자매님들이 정말 애정하고 계십니다씻고나면 보내주신 로션샘플만 바르구요ㅎ
76,4,피부가 뽀송뽀송해집니다피부가 뽀송뽀송해집니다
77,4,아토팜 유명하지요디자인은 귀욥네요잘 써볼께요아토팜 유명하지요디자인은 귀욥네요잘 써볼께요
78,4,캐이스도 깜찍하고 촉촉하니 좋아요캐이스도 깜찍하고 촉촉하니 좋아요
79,5,샘플을 많이 주셔서 깜짝 놀랐어요샘플을 많이 주셔서 깜짝 놀랐어요
80,5,제품꼼꼼 빠른배송 샘플듬뿍감사합니다초등학생 어린이날선물 준비해습니다제품꼼꼼 빠른배송 샘플듬뿍감사합니다초등학생 어린이날선물 준비해습니다
81,5,퍼프빨기 힘들어서 결국은 손으퍼프빨기 힘들어서 결국은 손으로 바르고 있지만 아이가 재밌어하고 선크림바르는걸 좋아해서 만족입니다
82,5,케이스도 이쁘고 너무 흡수되는거 같아요케이스도 이쁘고 너무 흡수되는거 같아요
83,5,편리해요 좋아요 부담없어요편리해요 좋아요 부담없어요
84,5,만족합니다 케이스예뻐요만족합니다 케이스예뻐요
85,5,아이가 너무 좋아하네요 진작에 사줄껄 그랬네요아이가 너무 좋아하네요 진작에 사줄껄 그랬네요
86,5,너무 좋아해여  아이가 항상 지너무 좋아해여아이가 항상 지니고 다닙니다 분홍케이스도 있기를
87,5,아이들이 사용하고 트러블 없어서 재구매항아이들이 사용하고 트러블 없어서 재구매항
88,5,아이가 너무 좋아해요 트러블도 없고아이가 너무 좋아해요 트러블도 없고
89,4,배송빠르고 아이가 귀엽다고 좋아해요배송빠르고 아이가 귀엽다고 좋아해요
90,4,아이가 좋아해서 이거로 골랐어요아이가 좋아해서 이거로 골랐어요
91,5,조카선물로 저렴하게 구입했네요조카선물로 저렴하게 구입했네요
92,4,갠찮아요 잘 쓸게요 많이 파세요갠찮아요 잘 쓸게요 많이 파세요
93,5,열살 딸아이가 너무 좋아합니다열살 딸아이가 너무 좋아합니다이제 스스로 꼼꼼히 바릅니다
94,4,아이 친구꺼 빌려서보고사달라해서 시줬습니다빠른배송 고맙습니다아이 친구꺼 빌려서보고사달라해서 시줬습니다빠른배송 고맙습니다
95,5,모자도 안 쓰고 딸이 돌아댕겨서  너무 피부가 탔어요걱정이 되서 사줬더니 ㅡ 혼자서도 잘 발라요모자도 안 쓰고 딸이 돌아댕겨서  너무 피부가 탔어요걱정이 되서 사줬더니 ㅡ 혼자서도 잘 발라요
96,5,화학적 차단제는 트러블이 있어화학적 차단제는 트러블이 있어서 이 상품으로 구매했습니다약간 톤 업도 되고 비교적 뭉침도 적어 좋습니다
97,5,사용하기 편하고 초등학생딸이 잘쓰고있어요사용하기 편하고 초등학생딸이 잘쓰고있어요
98,5,선크림 발라주는데 좀더 순응도선크림 발라주는데 좀더 순응도가 좋아요
99,5,배송도빠르고 아이들이너무좋아합니다배송도빠르고 아이들이너무좋아합니다
100,5,애기용이라 비교하며 삿어요ㅠ좋애기용이라 비교하며 삿어요ㅠ좋내용
101,4,배송은 조금 느렷지만 애들이 좋아하네요본인들이 톡톡 바르고 다녀요배송은 조금 느렷지만 애들이 좋아하네요본인들이 톡톡 바르고 다녀요
102,5,아기가너무좋아하네요아기가너무좋아하네요
103,4,배송도 괜찮았구여름마다 이제품 쓰고있구요둘째가 이번엔 사달라고 했어요ㅋㅋ아이들이 캐릭터 귀엽다고 넘좋아해요잘쓰고있어요번창하세요배송도 괜찮았구여름마다 이제품 쓰고있구요둘째가 이번엔 사달라고 했어요ㅋㅋ아이들이 캐릭터 귀엽다고 넘좋아해요잘쓰고있어요번창하세요
104,5,아이가 너무 좋아했어요 펌핑 스탈인데 아이가 잘 펴바르지는 못해요 6살아이가 너무 좋아했어요 펌핑 스탈인데 아이가 잘 펴바르지는 못해요 6살
105,5,쿠션팩트인줄알고 열려고 애썼네요 ㅎㅎ누르면 한방울씩 나오는 시스템위생적이고 좋을것같네요썬크림사고 덧바를때 쓰려고 샀어요쿠션팩트인줄알고 열려고 애썼네요 ㅎㅎ누르면 한방울씩 나오는 시스템위생적이고 좋을것같네요썬크림사고 덧바를때 쓰려고 샀어요
106,5,아이들 10개 대량구매해서 선물로 주었어요만족해요아이들 10개 대량구매해서 선물로 주었어요만족해요
107,5,아이가 갖고싶어한 제품이에요최근제조일자 제품과 사은품까지 잘받았어요
108,5,여자아이가 톡톡 혼자 바르기 좋습니다여자아이가 톡톡 혼자 바르기 좋습니다
109,4,순하고 잘지워져요색도 이뻐요순하고 잘지워져요색도 이뻐요
110,5,빠른배송늬므ㅡ즈ㅡㅎ아요빠른배송늬므ㅡ즈ㅡㅎ아요
111,4,배송늦는거빼곤 다 좋아용배송늦는거빼곤 다 좋아용
112,5,아이에게 쓰려고 샀어요!!아이에게 쓰려고 샀어요!!
113,5,아직안써봐서 모르겠어요
114,5,만족합니다 좋으네요만족합니다 좋으네요
115,5,좋아요!!! 잘 샀어요좋아요!!! 잘 샀어요
116,5,잘 사용하고 있어요잘 사용하고 있어요
117,5,아이가너무좋아해요 잘발리고끈아이가너무좋아해요 잘발리고끈적임없어좋아요
118,5,아직 사용전이예요 성분 좋다고 아직 사용전이예요성분 좋다고 해서 샀어요샘플도 넣어주셔서 너무 좋네요감사합니다
119,4,잘 받았어요아이 두명거 주문했어요작년거 다써서 이번엔 아토팜 주문했어요로션크림거 원래 아토팜 쓰고 있어서선크림도 아토팜으로 정착하려구요사은품도 마음에 들어요마침 필요했던건데 여름내내 잘 쓰겠네요
120,5,4살 딸아이 선팩트를 처음 사보4살 딸아이 선팩트를 처음 사보네요괜찮으면 다시 구입할게요
121,5,애들이 너무좋아하네요 박스터진곳없이 잘받았습니다애들이 너무좋아하네요박스터진곳없이 잘받았습니다
122,5,아직 애기가 나오게 하는 법을 아직 애기가 나오게 하는 법을 몰라서 좋아요
123,5,5살 아들내미까지 열심히 두드려5살 아들내미까지 열심히 두드려주시네요
124,5,우리 손녀가 즐겨 사용 중! 만족우리 손녀가 즐겨 사용 중! 만족합니다
125,5,너무 좋아해서 엄청 찍어 바르네요 너무 좋아해서 엄청 찍어 바르네요 
126,5,편해요가지고 다니면서 톡톡 두드려줘요
127,5,배송오류가 최악이었어요배송오류가 최악이었어요
128,5,아기가 너무좋아해요아기가 너무좋아해요
129,5,저렴하게잘샀어요저렴하게잘샀어요
130,5,아토팜이니깐 믿고 사용합니다 아이들이 너무 좋아하네요아토팜이니깐 믿고 사용합니다 아이들이 너무 좋아하네요
131,4,애기랑잘쓰고있어요바르기도편하고좋아요애기랑잘쓰고있어요바르기도편하고좋아요
132,5,여분의 퍼프도 있고 샘플도 있어여분의 퍼프도 있고 샘플도 있어서 좋아요
133,5,트러블도 없고 아이가 참 좋아합니다트러블도 없고 아이가 참 좋아합니다
134,4,아직사용전이지만 괜찮을거같아요아직사용전이지만 괜찮을거같아요
135,5,초등학생이 쓰기에 좋은것같아요초등학생이 쓰기에 좋은것같아요
136,5,믿고 구매했어요 정말 좋아오ㅡ믿고 구매했어요 정말 좋아오ㅡ
137,5,이것만써요 순하고좋습니다이것만써요 순하고좋습니다
138,5,저렴한 가격에 잘 샀습니다!저렴한 가격에 잘 샀습니다!
139,5,잘받았습니다잘받았습니다
140,5,6살 아이가 화장놀이 하듯 선크6살 아이가 화장놀이 하듯 선크림 바르는걸 좋아해요약간 특유의 향이 있는데 아이는 별로 신경 안써요 전 조금 별로인듯 무향을 선호하는편이라
141,5,유치원 초등학교 저학년 아이가 유치원 초등학교 저학년 아이가 사용하려고 샀어요 작년하고 디자인이 좀 바꼈네요
142,5,아이가 너무 좋아해요 근데 클렌아이가 너무 좋아해요 근데 클렌징폼을 못해서 자주 못쓰는 아쉬움이 있어요ㅜㅜ
143,5,성분검색해서 구매했어요 아이도성분검색해서 구매했어요 아이도 맘에 들어하네요
144,5,사용하기 너무 편하구요아이도 좋아해요사용하기 너무 편하구요아이도 좋아해요
145,5,톡톡 두드리면 되서 사용하기 좋톡톡 두드리면 되서 사용하기 좋아요
146,5,굿가격이 저렴하면 좋겠어요
147,5,애가  좋아해요 애가  좋아해요 
148,5,아이가 넘 좋아하네요 일단 순아이가 넘 좋아하네요 일단 순한지 아이한테도 잘 맞구요
149,3,발림성은 좋은데썬크림은 백태현상이 좀 있는편이에요 클렌징은 아직 사용전인데 용량 넉넉해서 맘에들어요발림성은 좋은데썬크림은 백태현상이 좀 있는편이에요 클렌징은 아직 사용전인데 용량 넉넉해서 맘에들어요
150,5,아이가 좋아해요성분 다 검색해보고 샀는데 제일 나은거 같아요 ㅎㅎ아이가 엄마 화장 따라한다고 좋아해요
151,5,배송도 하루만에 오구 너무 좋아배송도 하루만에 오구 너무 좋아요  올여름에 거뜬하게 사용할거같아여
152,5,빠른배송감사합니다빠른배송감사합니다
153,5,아이도 저도 만족하는 제품입니아이도 저도 만족하는 제품입니다 백타도 없고 좋아요 
154,5,아이가 좋아해요 백탁현상은 있아이가 좋아해요 백탁현상은 있습니다 
155,5,아이 선물이에여가격 저렴하게 잘 구마해였습니다!
156,5,믿고 샀어요 여름 내 잘 쓸께요믿고 샀어요 여름 내 잘 쓸께요
157,5,매번쓰던거라 저렴하게 샀어요매번쓰던거라 저렴하게 샀어요
158,5,여름이라 선물하려고 샀어요여름이라 선물하려고 샀어요
159,5,아이가 너무나좋아해요ㅎ아이가 너무나좋아해요ㅎ
160,5,최고예요스틱이 편하긴하지만 아이가 엄마화장품에 관심가지길레 사줬더니 스스로 두드리면서 잘 바르네요바르면 얼굴이 빛나는 느낌?도 나고 향도 좋네요잘 선택한듯해서 만족요많이파세요
161,4,순한 성분이라 구매했어요생각보다 좀 뻑뻑하고 건조하긴한데 쿠션형이라 덧바르는용으로 좋을거같아요순한 성분이라 구매했어요생각보다 좀 뻑뻑하고 건조하긴한데 쿠션형이라 덧바르는용으로 좋을거같아요
162,5,저렴한 가격으로 구매햇고 빠른 배송 넉넉한 유통기한 좋아요저렴한 가격으로 구매햇고 빠른 배송 넉넉한 유통기한 좋아요
163,4,좋아요믿고 쓰는 아토팜이라 좋아요 가격도 저렴하게 잘샀고 케이스가 예뻐서 아이들이 좋아해요
164,5,ㅋㅋㅋ 썬크림 안바르려고해서 ㅋㅋㅋ썬크림 안바르려고해서 사줬는데화장품 바른다고 좋아라하네요작전 성공적
165,5,아이가 너무 좋아해요 화장하는듯 발라요아이가 너무 좋아해요 화장하는듯 발라요
166,5,배송도 빠르고 저렴하게 구매했습니다배송도 빠르고 저렴하게 구매했습니다
167,5,케이스도 이쁘고 발림성도 좋아요케이스도 이쁘고 발림성도 좋아요
168,5,감사합니다 잘쓸께요감사합니다 잘쓸께요
169,5,구성이 너무 조아요구성이 너무 조아요
170,4,딸이 좋아하네요 노란색 좋다며 만족하네요 애기때딸이 좋아하네요 노란색 좋다며 만족하네요 애기때부터 쓰던거라 계속써요
171,4,택배박스는 많이 구겨져있었지만 다행히 제품엔 이상없이 잘받았습니다택배박스는 많이 구겨져있었지만 다행히 제품엔 이상없이 잘받았습니다
172,5,너무 좋습니다용 배송도 빠르고 만족합니다용너무 좋습니다용 배송도 빠르고 만족합니다용
173,5,5살 아이가 직접 썬크림을 바르네요제품 좋아요5살 아이가 직접 썬크림을 바르네요제품 좋아요
174,4,좋습니다여름에 유용하게 잘 쓸  것 같아요좋습니다여름에 유용하게 잘 쓸  것 같아요
